319475,2.7,Daniel,Kelly,15,0.4053938521081639,He is the type of teacher that drives you crazy. He does not have a rubric and never tells you what he wants from your writing. DO NOT TAKE HIS CLASS.,"No rubrics provided. Grades all given subjectively based on his opinion of the student, not the actual work. I approached him multiple times asking why and how he marked things off on my papers and he never had an intelligent response. Refuses to give a 100 on any assignment, even if he made no corrections the highest score he'll give is a 95.","Go to office hours, ask questions, and you'll be fine.  He just wants to see effort from his students - if you show that you're invested in the very easy class, that means a lot.","This is kind of a weird class. You'll probably get an A and if not certainly a B, and it's really useful to build your resume writing skills. But the group projects and some of the assignments are just way too much work for no reason. There's pretty much something due every class but it's usually only like one page of writing.","He doesn't have a rubric for the class. He can just mark everything off if he feels like it, and that is what he actually does. He DOES NOT GRADE FAIRLY. He definitely gives good grades to people he likes. Very subjective. If he teaches BTW250, do not take it.","From experience, very bad professor. He grades very subjectively. No matter how much work you put in, or no matter how many times you go to workshop, you will get the same grade. He is an English major, not business major but teaching a business course. He does not have a rubric so he can give whatever grade hewants","This class was a waste of time and I learned absolutely nothing. The professor doesn't explain what he really wants in a paper. Several times I went to writers workshops and never got an ""A"".  A classmate of mine worked at the career center for editing resumes and got a ""C"" on her resume. I recommend NOT taking this class with Kelly.","Graded subjectively. Waste of time. Even when I went to writers workshop everytime, I got a B- for the work. Should try to avoid his class. Picky Prof.","Class is an easy A - almost a total blowoff. All we do is write a resume &amp; cover letter, then a couple of short assignments and open book quizzes. If you get anything less than an A in this class you put absolutely no effort into it b/c he lets you rewrite every grade B- or less. How people fail open book quizzes is beyond me...","pretty stupid class. taught poorly. Too much work.  Basically an assignment due when there was a class. I wish that I did not take a class with him, even though I expected to get a good grade in this class(above B+).","This class is hilariously easy. If you have any idea how to write and are willing to give minimal amounts of effort, you will get an A. As for Kelly, he doesn't seem to understand business at all, which is odd for a business writing class. Don't expect to learn too many things from this class.","This class was mundane. The class was difficult but I did get an A. If you have to take the class, you will be fine, but it will not be preferable. He gives recommendations on what to write about, and you need to follow his recommendations. Keep your papers basic, to the point, and based on what he says in class and you will get an A on the essays.","This class is really easy. We had a lot of quizzes, but they were open book. There is one large client project at the end but other than that, there are short papers (like a resume) due throughout the semester. Pretty Easy. I got an A.","Laidback &amp; helpful guy. Attend his office hours and ask him for critique on paper, he'll give great advice - follow them and you should get a good grade (I was able to get many As doing this). He has rewrite option for first couple papers. Quizzes in class - pretty easy and later on, open book. Not a blow off class, still need to put work into it",this guy is really laid back.  He made this class a joke when i have heard nightmares about other prof's for this class.
889778,4.5,Chris,Kelsey,1,0.7633084341722345,"A US army major who has been there and done that, Kelsey is pragmatic and direct.  No note-taking, as packets are passed out as necessary, and you are allowed to use them for the tests.  If you have a less than lily-white sense of humor, you'll find him great to listen to.  Lectures and concepts are simple, and he acknowledges it.  fun and easy."
324527,3.5,Paul,Kelter,32,0.4779238233549018,"he's a really i guess jolly man would be the word. sometimes you get lost in lecture, but if you try to understand it and then ask him for help, he's more than willing to help you out. the discussion section you need to be careful about...that's where your quizzes come in.","One of those professor's that would rather have fun in lecture than actually teach material. Used some overcomplicated examples to explain some very simple material. Relied too much on the TA's to teach things so that he could just do demo's in class. Required a lot of outside learning. If you had a question though, he would always email back quick","Helpful teacher, not easy to get an A though.","Makes lectures interesting, but spends too much time on useless information sometimes. He doesn't seem to understand that advanced concepts need to be explained more.",A balding bill nye the science guy who lits himeself on fire on occasion.,He is a very cool and exciting teacher. He is very helpful and does a lot of experiments in class.,"Lectures are dull but sometimes blows things up.  Overall likeable guy, very friendly.  Tests are challenging and class overall requires much studying/reading on own.","Stoked about chemistry, but his tests are not easy  myspace.com/khanman225",Good overall teacher.  Very enthusiastic.,"he's very excited about chemistry, he has a ton of enthusiasm but his tests kinda suck.","he defiently makes the student interested in lectures... chem can be boring, but he does a very good job with the subject, in my opinion.",No Comments,No Comments,Awesome teacher! such a funny guy! CHEM 102 lecture is actually sorta fun cuz of him!,Very helpful and friendly if you want it.  Lectures are a little pointless and test material is very hard to study for.  Kind of screws students in that respect.,He brought the class to life at 8am. I enjoyed the fact that he got to know majority of the studnets in a 300 person class. He is very6 down to earth. If you read and study your material it should be an easy class.,Very easy class... If you have a simple chemistry background from high school it shouldn't be too difficult. It takes hard work and studying but its reasonable... but the TAs don't help very much at all.,Worst class I ever took. He goes off in so many different directions that there wasn't even a point to going to lecture. His study guides are no help. He doesn't make up the online quizzes so you can get ****ed over there too. His T.A.s suck too.,"Not helpful, focuses more on being a friend than teaching, not good with lower level courses, does more demonstrations than needed which makes a fun class and not much learned.  I learned everything from my lab t.a.","I ended up not going to lecture by the end of the semester because I didn't feel like I was getting much of out of them.  He tends to go off on tangents and not actually teach the material.  He is, however, the deparmental head, I think, so if you're a chem major, you might want to get to know him."
1270813,4.6,Athol,Kemball,21,0.608410336412729,"Dr. Kemball is a relatively good professor. His lectures can be a bit dry, and participation in them is graded by 1-3 iClicker questions during the lecture. Homework can be a bit challenging sometimes, but he provides an extra credit question on each homework and test, and he allows for a cheat sheet during tests which do help.","He speaks a little lethargically, which makes lectures a little unexciting. Runs an easy course where moderate effort is returned with a good grade. Offers a ton of optional extra credit. Online quizzes are fairly simple so long as you have the textbook on hand.","There is a lot of material covered in the class so that's no fun. However, he provides plenty of opportunity to still get a good grade. Multiple chances to complete HW. Lots of extra credit opportunities. Good at dry humor, makes lectures interesting. Have lots of respect for this professor.","Prof. Kemball loves his students and loves what he teaches, but you can tell he is more interested in his research. He brought us cookies and coffee every friday! :) The class was not too bad (dry lectures) with a cheat sheet on each test. I loved the content of the class and Kemball was so kind and warm-hearted!","I clicker points (minimal), group project, extra credit (close to like 15%), its easy and interesting--usually. He's also happy and a nice guy. Take it.","First off, by far one of the coolest classes I have ever taken. The professor is a straight up dog! He's super nice, funny, and helpful. He assigns a bunch of extra credit and very little EASY homework. Exam is easy if you just review your homework. Once again awesome teacher.",Professor Kemball is great! He is seriously so nice and will help you with anything you need. The class was very interesting and he kept your attention with the fascinating things you learn about Astronomy. He definitely knows what he is talking about and overall doesn't assign too much homework. 1 assignment a week...and reading...def recommended!,"This guy is so helpful; if u do his homework carefully u would definitely get a high mark on the exam. 80% of the exam questions are among the homework which is once a week. And if u do good on mid-term, u could replace the relative part in the final with the score u achieved earlier. The best prof ever.","GREAT professor. He knows what he is teaching and really enjoys it. I have heard other astronomy classes are not easy but this is easy AND interesting. you DO have to study for tests or at least show up for class  if you want an A but you get a cheat sheet. also, there's extra credit opportunities.","Love Prof. Kemball. One of the best teachers I've ever had. He's excellent at explaining things and really does try to make it a class everyone can do well in. There's a ton of extra credit offered. Plus, he makes it interesing and has a really cool accent.","I didn't have the textbook and slacked off majorly in this class and still got a B. It was interesting material too! Athol is the man, he adds a lot of cool animations to his power points. You can copy and paste all the homework questions into google and get 90% of the answers although if you pay attention you won't need too.","Amazing professor. He offers a lot of extra credit. He is very approachable and friendly. He realizes this is just a gen ed, but he still managed to keep my interest.He had open office hours for 8 hours the day of the final because that's just the kind of guy he is. If you want a safe, fun, and friendly gen ed, this is not a bad decision at all.","Kemball is such a nice and friendly person. He is also a great professor who is not only knowledgable in the subject, but also very engaged in it too. The class isn't too hard if you put some effort, and he also gives a lot of extra credit opportunities. You will definitely be awed by the things you learn about the universe and beyond.",Kemball is a very good professor. The lecture is very interesting but sometimes is a little hard to understand. He give a lot of extra credit which can help you get an A easily.,"Professor Kemball is a very intelligent man who really knows what he is talking about. Lectures were very fun and engaging. His TA wasn't the best and towards the end of the semester he moved quite fast, but the class was easy to do well on and pretty interesting.","Best teacher I've had so far.  Really made class interesting, and his accent helped.  An EXTREMELY intelligent man, he really does a fantastic job.",Very hard (but interesting) material. But Kemball has the COOLEST accent and gives you a lot of opportunities to improve your grade.,Very nice guy who knows a lot about the subject.  Sometimes he gets a little monotone but still a good teacher.  He has excellent powerpoints and a lot of homework/ extra credit opportunities.  He's also british; love the accent!,"He pretty much explains everything, and has awesome power points that he tells you to print out to make notes insanely easy. Homework is also not that hard generally, and you get three tries on it. definitely an awesome professor.","This professor is amazing. He has the coolest english accent, which makes you just want to hear him talk.  The class isn't at all difficult, and if you do all of the extra credit offered, it can raise your grade 13.5%. He is very approachable also."
2229381,3.0,Jongsook,Kemper,1,0.27503307653910003,"She doesn't have a defined grade range and calculates that after finals. Don't go by her estimates of what an A is, because she's not usually right and her definition of an A sometimes changes to include A-s."
1861219,2.1,Lori,Kendall,7,0.4696639213397208,"Basically you are assigned a bunch of readings. You write 4 essays, which are not to hard if you follow the guidlines stricltly. Iclickers are graded for correctness, and the final is really hard and worth a lot. Most of the things they test you on feel arbitrary.","This Professor lacks one major characteristic that makes ok professors, great professors: Consideration. I have come to this professor with many issues and to be honest she has shown me a lack of consideration. Nevertheless, the course is interesting.","Professor Kendall's lectures were extremely boring. Each lecture has few slides with almost no visual aid and so this makes it very difficult to stay attentive in her class. The course material is interesting, though. Every week had 2 reading summaries which were easy but a pain in the butt. Overall, easily passable but boring course.","Lori is a very boring lecturer who rarely excites the class. The course is based on reading summaries, some of which are very interested. Luckily, you need not attend class and listen to Lori drag on about the exact same material you read about. I'd advise against taking one of Lori's classes if you don't have to.","No slides share, obscure instructions(she often just read stuff from her own materials a lot of time without showing them on the slides, she just expect you to catch the story solely based on her standing there and reading, LoL). Walk through slides fast so you better be fast at note-taking.","It's fun class. I really enjoyed all the topics covered in the lecture. Although there were a lot of readings to do and all the summaries were driving me crazy, I really enjoyed this class. Very relevant and close to our daily lives. Loved the class.","She is a great lecturer. I actually enjoyed her class. Most of the things covered in the lectures are very relevant to real life. Her TAs also have good feedbacks when you have questions about the lecture. But there are a lot of readings to do, and a lot of summaries to write, which are very tedious, but very helpful. Frankly, it is easy to get As."
731407,1.8,Barbara,Kendrick,2,0.47377745559552714,"she's ok.  a sweet lady, can be a bit scatterbrained in an endearing way.  can be difficult to please.",Babs has a very specific drawing style that she wants everyone to convert to using and her projects were very unclear. i feel like my drawing skills regressed when i was in her class and i had to work extra hard the next semester to redeem them.
93138,4.1,Paul,Kenis,5,0.42047861880791587,"Very helpful and nice, but I had trouble understanding his Swedish accent","He was an alright teacher, but his blackboard handwriting was quite sloppy and his German accent was difficult to understand.","maybe not the best lecturer ever, but he doesn't get all mady if TA's/students point out typos &amp; mistakes  But most importantly this man would bend over backwards and kiss his own ass if it would help a student understand, all you need to do is ask",No Comments,No Comments
80294,4.8,Catherine,Kenney,3,0.47135531436615413,this class is so easy and she is one of the nicest people you will ever meet. There are only 2 papers required and a group presentation. That's it. It's cool class.. sign up,"Not only was his German accent hot but he kind of reminded me of the guy from Rock IV, the Russian guy that Rocky beats.  He seemed a little hung up on his pet birds but was pretty cool besides that.","Incredibly nice, class consists mostly of discussions, fair grader. Only bad thing is that a lot of reading is assigned."
2168633,4.7,Angela,Kent,3,0.5849449525619799,"Extremely knowledgeable about the topic and gives a lot of great modern examples. An average lecturer, sometimes she can make an hour and 20 minute class feel like an eternity. She makes notes handouts for every class so it's hard to get lost. There are reading quizzes, online exams, and debates so you have a lot of opportunities to do well.",Prof. Kent is an amazing teacher! She is very put together with class and has power points online. Her lectures were very engaging and fun. Tests were online but timed! iclickers used! Had discussions which needed to be typed and submitted along with papers. Gave lots of chances for points!,"I took NRES 102 with Professor Kent, and loved it. The homework was simply online reading quizzes that were not taken for a grade (but helped understand the material). You had to do the online quizzes or you would lose points so it was better to just click through and answer randomly before the deadline, then go back later and actually take it."
1684939,4.0,Andrew,Kerins,1,0.45349566173408423,"Difficult class, but worth the work. All assignments and projects were applicable to real life situations we will most likely face at some point. A little vague with directions, but he is very approachable if you have questions. Didnt have high hopes for this class, but it was actually really interesting"
1348404,3.3,Ely,Kerman,14,0.37483250457708855,"I completed the Math 416 course through UIUC's NetMath program where the lecture videos were from Professor Kerman's Fall 2016 Math 416 section. Very high quality and well structured lectures, would definitely recommend! Homeworks were quite challenging and proof-oriented, while exams were a bit easier and more computation based.","I took him for MathLab Abstract Linear Algebra, a real tough class with a hard theoretical textbook. But going through my lecture notes, it's all crystal clear and succinct. Don't go to UIl (fancy private school instead) but guys like this make me wonder what I pay extra for. If you do online though, watch out for the TA... grading can get harsh.","Math 225 is not a difficult class conceptually, and Kerman does a serviceable job at lectures. You don't really need to go to class to be honest but that's just because the material isn't hard to pick up on your own.",Very clear in his speaking and notation. Conveys points well.,"He wrote his notes on the board. He did not look at the class at all, just talked to the board. I never knew what were good problems to look at that would help study for the exams. He made the second test ridiculous compared to the first and third one. Not much of a curve on any of them. He definately is the hardest teacher for calc 1.","He only copies his notes onto the board and speaks it out loud as he writes. It's kind of hard to figure out if you should even take notes or just watch because he just writes and writes the entire class without much interaction. It's almost as if he's writing the book on the board, and math books are not easy to understand. Do the online homework!","Sometimes seems nervous in class.  Has trouble understanding students' questions, and therefore answering them.  Test questions more difficult than information covered in class.  But, if you do all homework and pay attention, you can do well in the class.","I slacked more than I should have, but even so, I had no idea what would appear on the first test (and bombed it).  The rest of the tests were reasonable.  Class was really boring though; I had trouble staying awake often (my eye lids were literally significantly heavier once he started talking).","I don't see why other reviews complain a lot. He is willing to understand student's situation and his grades are fair. Exams are not by the book but if you do what you are supposed to, you will do fine.","I had him as well for Calc 231 but I dont see the problem. I liked him a lot. He was the right level excited. He was very competent, hence the PhD in Mathematics, he was nice to answer any questions, neat and organized and fair. He wasn't amazing neither was he awful. Tests were fair. Just do the suggested problems and you'll be good.","Calc 231 was definitely a challenging course.  Had an A in Calc 221 and I super-aced my first exam in Calc 231, but things kinda went downhill from there. The homework was always much easier than the exams (except for the first one). Kerman isn't the best lecturer; he just copies his notes on the board and repeats it. My T.A did a better job.",Ely was the worst professor I have ever had in my life. His incompetence and lack of grasp on general social skills made him impossible to follow and his lectures overall useless. His test are utterly impassible and he puts up incorrect answers to practice problems. He can't figure out his own problems. Did he attend an accredited university?,"This was the worst experience of my life. I never felt so lost in a class until I had this ""professor."" Half the time he didn't know if he was right or wrong while doing examples on the board. Not to mention, the practice problems he gave us before exams had wrong solutions. Exam averages are in the D range, and he didn't curve it.","He's a lot easier than other Calc 2 teachers I've heard of, I strongly recommend him. His tests are definitely ace-able, as long as you know the information."
2257175,5.0,Justin,Kern,1,0.6952570567864873,"Justin really knows his subject well. He takes real world examples and uses them which helps you understand the material much better. Incentive to showing up for class w/ an extra credit final that is earned, which is great because it encourages you to try that much harder. Wish ALEKS wasn't used but it gives partial credit on exams."
1868417,5.0,Renique,Kersh,2,0.6314182891321654,"You can straight google the exams, there's not reason you shouldn't do well in this class. Kersh sends out reminder emails and he's always good to level with you because it IS an online course. Just remember to do the work each week and put in a 50% effort and you'll ace it.","You absolutely need the book for this online class.  Every question from quizzes and exams comes straight from the textbook.  Therefore, it is not really hard if you religiously use the textbook."
2046302,1.3,Mariana,Kersh,3,0.33011216515071035,"There was an INSANE amount of cheating in that class and the profs were too lazy to fix it. We had biweekly quizzes (50%) that were spread out over the course of 5 days, and a day later everyone had answers. It WRECKED the curve. Grades are not an accurate representation of understanding and I worked my ass off to even get a C+. CBTF is a joke.","lectures were confusing. three homework assignments a week which is pretentious. Only online quizzes and you need to know how to use software or you will not pass. This class is the ultimate weed out, avoid it if possible and take it at an easy college.","Not great. Simple, interesting class was made horrendous by disorganized teaching and logistics, including being taught innumerable concepts incorrectly. Not captivating in lecture or helpful outside. Seems to care about students, but doesn't take accountability to help them succeed. Made future TAM classes difficult as well, avoid if possible."
2046352,N/A,Mariana,Kersh,0,0
