848397,4.6,Ron,Kovatch,7,0.779381179187191,Interesting teacher and easy to talk to. Grades is based on the effort of your drawing with different material and style. Class time is about doing the drawings and have it done on the day for critique.,"Ron is helpful, slightly insane, and a whole lot of fun. He's tough on attendance and effort though. You won't get very far on BS alone. Definitely worth taking his class. You learn tons and he's a great guy!","take a class with ron! you will love it. drawing was one of the only classes i looked forward to going to. he is a lot of help too, &amp; fair grader. dont hesitate to have a 1-on-1 convo with him about anything - youll learn a lot! very interesting and funny. never dull! improved my drawing skills tons with him","He is my favorite, if you have a chance to take a class with him, take it.","He's really tough but if you can't take the heat, get out of the kitchen.  Ron prepares you for the real world when you and only you will defend, promote, and make your work.","Ron is one crazy cat. We made images out of fireworks and plastic resin and loved every minute of it. He doesn't focus on classical drawing but skips right to concept, appreciation and human experience. You'll definitely have a good time...or be creeped out...he's a free spirit.","Ron has got to be the best teacher ever.  He's funny, interesting, very intelligent.  Completely anti art school establishment!  He actually thinks you should be able to make stuff!!!  He is a very fair grader and helpful, although you have to ask.  I would recommend him to anybody! Lots of fun!!"
1274445,4.0,Michele,Koven,11,0.6488526813752503,"Great professor, very nice! She is so helpful whenever I need assistance.",Prof Koven is phenomenal. She is very clear and makes the often dense material accessible to students. She is also very helpful if you need further clarification. She is a fair grader as well.,Prof. Koven can be a bit boring when you are in class but the readings and lectures are really interesting. The test are straight forward and she allows you to have a cheat sheet. You must do the readings and understand the  concepts each author uses. Great class!,"Michele Koven  bases a VERY LARGE MAJORITY of her test material on what authors said what and how one author's writings compare to another author's writings. Not much care is given in being specific in project rubrics. In our final paper rubric she wrote we should structure our paper according to ""FAIRLY specific guidelines."" Such as? Enough said.","One of the very best professors I've ever had at UIUC! She sets clear expectations, and she is always willing to help students. Yes, there's a lot of reading but the readings are fascinating. I would take any course she teaches!",This teacher is knowledgeable.  This class is not for seniors the amount of reading each night is around 30 pages (which is a lot of a 200 level class).  The exams are straight forward but if you don't read or pay attention you will know absolutely nothing for them. I thought this class was more about culture but is all about language use.,"No textbook, but a ton of article readings (some of which are long and pointless).","I learned so much in this class--made me really aware of myself and what I say and do. She does a great job of leading discussion and answering questions. She makes really difficult readings/research/concepts clearer. She loves hearing our opinions and learning new things from us, also.","The amount of reading for a 200 level class is excessive. I devote more time to reading for this low level 200 class than i do for a lot of my 400 levels. She is a very kind person but very inflexible about her schedule. She is only willing to meet during office hours or will have a phone conversation with you, which is awkward. Overall it is easy","she's very kind and very passionate about what she teaches. not challenging material but moderate amount of readings and work. class consists of 2 easy projects, a midterm, a cumulative final, and some short in-class writings. material was interesting and beneficial...makes you realize how much we take for granted our way of thinking.","I loved this class.  It is definitely challenging and it really makes you think differently about the role culture plays in the world. One take home test, one in-class final, transcript and analysis paper are due for the class. 15 Reading responses are also required (which are really easy).  I definitely recommend it."
2278921,2.0,Sanmi,Koyejo,2,0.2951815372454408,Easily among the worst professors out there. It seems that he tries very hard to make concepts seem as abstract as possible. There are few examples in lectures and even those are not concrete enough. The homework belongs in a math class and not in a Machine Learning class. Expect to learn very little ML by taking this course.,Super hard class!
2455181,N/A,Adam,Kozak,0,0
1428447,5.0,Jason,Kozlowski,2,0.8269098115002942,Great teacher. Always upbeat. Easy to talk to and bounce ideas off. Really brings history to life.,"Great teacher, class was interesting and participation made it much more beneficial and enjoyable. Great guy to go and talk to and always open to his students ideas. Best prof i have had at uofi thus far."
1710120,3.0,Tomasz,Kozlowski,9,0.4389240401220598,"Extremely fair grader. You will definitely have to read the book and go to lecture to get an A in this class. Try and do the homework early so you can come to class with questions, because he will answer questions in class. Overall a very interesting and engaging class.","Absolutely amazing professor. He gives clear requirements for every assignment, going so far as to tell you everything you could possibly lose points for on the computer projects so you can make sure you get a good grade. Tests are long for the time given, but if you go to class,do your homework, and make your cheat sheet you'll be fine.","Unclear criteria for important assignments. Condescending towards students. Will not answer your question if he decides you should already know the answer. Pay attention in lecture all you want, when you get to the homework you will not know how to do it unless you fully read the preceding chapter.",Is this really an introductory class? I really doubt it. Computer project are graded harshly. Exams are so hard that your cheat sheet becomes useless.,"Agree that he cares his Pokemon rather than his students. It is exactly 24 hours before the final, and he has 3 hw solutions that are still not posted. No sharing materials for study and review, since ""the textbook is your study guide"" he said in class. Cannot understand his explanation in most of the conceptions.",Never meet such bad professor,"Prof Kozlowski is one of the greatest profs I have ever had. Prepare to work hard, especially with the computer projects. He teaches in a very structured way. Follow the book, show up, and PAY ATTENTION and the homework and exams will be no problem. Just prepare to work!","His class is hard and his computer projects are graduate student level. Exams are basically homework questions. Not a bad professor but I cannot learn much in his class. Grading in computer project is harsh. Average professor, don't expect too much from him and be ready to work hard.","Professor Kozlowski is absolutely incredible.  I was worried that he would be hard to understand, but he has honestly been my favorite professor thus far at UIUC. NPRE 247 is rather difficult, CS 101 will NOT, and I repeat, NOT help you when it comes to the computer projects.  Other than that, he grades fairly and is just an awesome guy in general."
2225250,3.3,Alicia,Kozma,3,0.6029563177434153,"Do every extra credit item she gives you. You won't regret it when it comes to the end of your course. The pop quizzes and tests are based on critical thinking, so you better know what you've read and have an opinion and an argument to support it. Lots of discussion in class. Exposed to more topics in this class than in any other.","A class that is supposed to be centered around film and television, quickly is turned into a forum for her to stand on a soap box and share her SJW opinions. Easy grade if you can wrap your mind around the mindset that would agree to these opinions, but still zero merit to actually learning anything of real quality of film and Tv.","Learned so much. Very passionate teacher, makes you excited about learning."
596835,3.9,Matthew,Kraatz,4,0.6325489281840362,Normal class.  He did pick up some nice cases and articles for us to read.,Great materials used in class. The class is sometime boring but his well constructed cases and theories are perfect to understand leadership.,He is a great professor. I love him!,No Comments
1705963,3.3,Mary,Kraft,3,0.3327494560735413,"Great classes, lots of content but all very well explained. Examples dissected. Weekly homework force studying every week, which is actually good because the material is extensive and can't be learned in a blink of eyes. 1-4 questions worth points every class. Exams are too long for the time lot, so you have to be incredibly sharp to finish it.","Had to miss an out of town job interview because of her exam attendance policy (no excused absences.  That includes medical emergencies).  I pay $100k to attend UIUC to make myself marketable to employers, and this lady forgets why she's in business.","Very math intensive class, and she hits you with slide after slide of numbers. Be ready to do a lot of review and put in a lot of time for homework. She does split up tests into  ""quizzes"" every two or three weeks with one final, which is definitely a better system. She also puts everything online if you miss a class or don't understand something."
1707243,5.0,Michael,Kral,1,0.49247884300908396,"Michael Kral is the best professor I have ever had!  Psyc370 Understanding Suicide was such an interesting class and I learned so much.  While it wasn't completely mandatory to attend class, I went every day because it was such a good class.  It was very emotional, and the topics were very heavy, but definitely worthwhile."
812630,5.0,Arthur,Kramer,1,0.6154480010932484,:)
812632,3.5,Laurie,Kramer,2,0.5846654419625738,"Very knowledgeable, but more interested in her research than teaching. Seemed to fake interest in us as students. Uses grad and undergrads as cheap labor for her research lab",:)
2130830,2.6,Elise,Kramer,5,0.4287800440645523,Kramer's lectures weren't very interesting. One could possibly get away without attending them. All the material she covers in class is available in the lecture notes she uploads before class starts. Make sure you do the textbook readings for the quizzes but there is no need to go over the textbook for the final.,Was not a very good teacher. She tended to force her political opinions on the students and was not very helpful. Would not recommend to anyone,"I have taken so many advanced level courses and while I took this as a Gen Ed, I found it to be even harder than the three advanced courses I was taking. She is so pretentious and is very discouraging whenever you have questions. On top of that tests are worth 35% each and contain little of the information learned in class. Don't take this class.","She wasnt a very interesting lecturer and the topic COULDVE been interesting, but the way she had explained things just was dry.","A great teacher, who covered a lot of material without seeming rushed. The class was really interesting, and due to its small size, it was easy to participate in and feel like a part of the discussion. The papers were actually fun to write, which is something that almost never happens for me."
2225987,N/A,Karen,Kramer,0,0
2315188,4.3,Allison,Kranek,3,0.41251523635151455,she's a really caring teacher!,"Rhet 105 is a mandatory class, so don't try skipping it, or else you will fail. She is a really nice teacher and brought in food a couple times throughout the semester. The only thing I did not like was peer review days because I felt like they were pointless. She gives students lots of chances, and because of that, I would recommend her.","Attendance is mandatory. Don't bother purchasing the book, waste of money. However, she is very sweet and caring. Even brought in food for us one day! Just do the short writing assignments (super easy). There is a research paper for the end semester then revising it. Annoying but easy. I'd take her if you can. The class was a breeze and enjoyable."
844096,4.3,David,Kranz,10,0.5509091304400854,This class was super easy. It's a very easy way to get your science credit for those who are not STEM majors. Professor Kranz was awesome.,The exams often test very picky details and there are a lot of passage based questions. Wording of multiple choice makes it easy to miss if there's a slightest bit of doubt in your mind. Honestly this is one of the most relevant MCB courses I've taken. Lots of memorization in the first half. But also an emphasis on understanding.,"Kranz's exams feel like an all immunology version of the MCAT. Passage based questions. Stand alone questions. Emphasis on application. He puts ""More than one answer is true"", ""Both A and B"", ""None of the above"", etc as answer choices to see if you truly understand the material. There is a lot of detailed memorization as well. Not an easy class.",Kranz is a very engaged lecturer but loses focus on topics easily.  Tests are very difficult and questions are tricky/confusing. Overall a difficult course.,"I was in this Class Spring 2010. Professor Kranz is really interested in Immunology and he was lively and engaged at 9 in the morning. The Tests are really hard, but if you study directly off the lecture slides, you can get an A on the 4 lecture exams. Almost all exam material comes directly off lecture slides. Kranz is a nice guy, gives hard tests","I took this class because I heard from fellow upper level MCB students that it was easy.  While the grading scale is generous, lecture is boring and tedious.  Kranz will start one thought without finishing another.  The class is interesting, but it takes a lot of self discipline to take the time out and study properly.","The exams are hard and require a lot of studying however the grading scale is generous (40% a's, 40% b's).  I would recommend having some interest in the material as there is a lot of studying per exam","Excellent professor. He's had a bunch of success in his professional career, but he's still as friendly, accessible and willing to help as can be to the undergrads who take his course, which is generally rare with professors that have had his level of success. The class itself has a very generous curve, and the tests are manageable,take Immunology!",GREAT TEACHER AND CLASS. extremely helpful professor. highly recommend this class to any of you mcbers who are pre-med.  i have never learned so much about immunology.  he keeps the class interested with not only his humor but with random videos that have nothing to do with anything!  plus 40% receive As and 40% get Bs... not bad!  but study hard!,"Damn good, only a bit to fanatical about antibody structure. Best MCB class ever! For once a teacher that won't bore you, and actually keep you awake (yes that is possible even for an MCB class)."
784005,2.6,Stephan,Krasa,16,0.4407212192875817,Do not take any class with him. Very boring class and need more time to practice and you should be good at MATH.,He is very good. He explains very well and has a very good interaction with students.,"This is definitely a course that you have to work on. But getting an A is easy if you go to class, do the homework and really understand the key concepts. The math does not go beyond basic calculus and matrix.","Unless you are familiar with complicated high level mathematics, do not take financial economics. Math skills aquired solely from economics courses will not be helpful at all in this course.","No matter how interested you think you are in this subject, trust me, it's not enough to justify taking this class. Impossibly hard.",don't take this class,Impossible,financial economics. dont do it.,"Did a great job. Take him over any Econ 302 teacher. He can be a little dry and boring, but he's very fair, generous and won't make you feel dumb if you have question.","A bit eccentric, but patient with students and explains course material clearly. Great Professor! Material is not hard if you go to class.","Crazy Austrian Economist from the University of Vienna.  Although he knows his stuff, he is extremely dry.","He really helps a lot and has an interactive class. He goes around to make sure you understand the math. The tests are managable if you go to class, and he gives a pretty good curve as well. From what I heard, I would take him over any other 302 professor...","The final was ridiculously hard for this class. None of the type of problems on the exam were ever given to the students as homework, practice, or web problems. It's almost like he needed to lower the average grade of the class.",One of the worst classes and professors on campus. His teaching is absolutely pathetic. I recommend noone to take him as a professor.,"Great teacher, the curve is very generous, if you go to class you'll have no problem understanding any content presented in the class.","He has very good slides presentation...but they are of no use!Dont waste paper printing them !Exams are tough....you will find nothing similar to what you have learnt throughout the course.He has his own methods of proving problems....and expects students will write on the exam paper exactly what he has in his""MIND"".In the beginig of the sem he tel"
205551,2.8,Michael,Krassa,54,0.2465245124412172,He was very boring during class but you should definitely go. You won't do well if you just go to discussion and read. Most of the test are based from lecture. Nice guy though and he will help if you go to his office hours. I got sick with pneumonia and he was very helpful over email and let me take the test anytime I wanted.,He gets off topic a lot during lectures. Tests are based off of readings.,"Krassa is a boring lecturer, but go anyways. The exams are based off of lecture.","Dear lord, this guy is not a good professor. I passed this class because I knew the constitution and did well in my AP US history class in high school. Krassa also promises podcasts and never posts them, so watch out and don't rely on that. I fell asleep in every lecture, he's that boring. But the TAs saved my ass in this class.","Stay away from any class this guy teaches. His lectures are the most boring I've ever experienced. He writes everything down on paper, barely comes prepared to lecture, talks extremely slow, and always goes off topic. The exam questions are always worded strangely. Even so, the TA's are extremely helpful. They basically teach this class themselves.",class is so dry and boring; the way he lectures contributes to less than 30% attendance every time. barely any prep given for tests and the questions are always worded in the stupidest ways. the TA's are the only saving grace for the class. you can get an A or B if you actually read the whole book and study for years. not what i expected at all.,His lectures are dull and not organized without powerpoints nor outlins. He just writes whatever he wants on a piece of paper. Too much reading materials for a 1evel class. The exams are hard and graded by TAs. He does not talk about anything related to the textbooks. He is very old and should retire.,"If you go to lecture, read your textbook and go to discussion, you will do fine in the class. Tests are not too bad, but your grade primarily comes from three tests.","Possibly the worst professor I've experienced so far. The guy obviously doesn't come prepared for lecture. He just stands and rambles for an hour, mostly about things that aren't even related to the course. The guy's a bad joke. Thank God for the TA's. They could each individually do a better job than him.",The TAs are the saving grace of this class. Krassa's style of lecturing is standing up on stage and sort of stream of conscious-ing whatever he feels is relevant. Completely unprepared for lecture. Get Audrey as a TA. Tests have curveball material on them. Don't take this class unless you have to.,No. Just don't take this class and don't look at the workbook!! Worst decision I've made in college! Who has typos in a college level textbook!? And Early lecture in the SOYBEAN RESEARCH CENTER?! Just trust me...Run away. Your GPA and your sanity will thank me.,"Krassa is a joke. Don't go to class and read the textbook. He holds class in the Soybean building a million miles away and ditches class without notice. Test are hard, but the TA's are awesome. Audrey is AMAZING. He study guides cover 80% whats on the test, but as long as you read the textbook your fine.","Professor Krassa is incredibly approachable, assigns books that are both interesting AND affordable, and leads class in a seminar format.  It was one of my favorite political science classes on this campus.   The topics are interesting and relate to daily life, and the paper assignment is open ended.","Krassa is a joke of a professor. I don't understand why he is still a professor. We NEVER discuss the course information, we NEVER stay on topic, and everyone in the class hates his teaching style. How can you learn if you have the most boring, least inspiring and uninteresting professor in the PS department? EPIC waste of time.",STAY AWAY FROM CLASS WITH THIS PROFESSOR. HE IS NOT CLEAR. YOU WILL NEVER KNOW WHAT IS ON THE TEST. VERY BORING. GOES OFF ON TANGENTS. GRADE MADE UP OF 3 TESTS AND DISCUSSION SECTION GRADE.,"I didn't think it was too hard. I read the book thoroughly and underlined lots of key things along the way so that when it came to the exams, I had less to study. Exams really aren't that hard. AP US in high school was harder. Take good notes and do not just write what he writes down. 9/10 times what he says is what is on the test not what he write",Probably the most boring class.,"This class seemed hard for an introductory course and he did not lecture clearly. Very unorganized and reading the book seldom helped on the exams. You basically have to write down everything he says during lecture to do well on his nearly impossible tests. Overall, he is pretty fair though.","Easy content but he makes it confusing. You don't find out until two tests in that his tests are 60% topics covered in lecture, which is incredibly boring. His textbook is terrible and you can't sell it back.",Terrible professor. Exams are definately a curveball every time. Avoid this guy! He can't stay on topic AT ALL. And one of the things he goes off topic and talks about for 2 min will be on the exam and count for a good chunk of your grade. No curves on exams or anything. He talks kind of funny. that is all
2238519,4.4,Gracjan,Kraszewski,5,0.6874060455576779,"The lectures are engaging and he tells you everything you will need to know to get an A in the class, so showing up is important. Essays are essentially participation grades and the quiz and exam questions are easily answerable if you listen to his lectures. This is an easy Gen Ed and very interesting for those who care about History.","I took his Civil War class a year ago. He is one of the best teachers I've ever had. Very friendly, funny, approachable, and helpful. Has a clear passion for his work and position. His class is not hard and he tries hard to make it as interesting as possible. Whether you're a history major or looking for a gen ed, his class is great to take.","Dr. Kraszewski is a refreshing professor who is clearly passionate about what he teaches. It helps to be a history nerd yourself, as the readings he assigns can sometimes be dense, but are appropriate given the lessons. He's more than fair with his grading, and I'd strongly recommend him to anyone that needs a 300+ history course.","He is a good professor and I like that he doesn't use slide shows.  I feel I know a lot about the Civil War without doing to much work.  He does go on a lot of tangents, often about books, but they often relate to the Civil War in some way or important topics to history majors.","Readings range from about 50+ pages for each class. Lectures aren't clear because the notes are written on the chalk board. No study guide for midterm. But the professor is nice and likes to joke around, although rambles quite a bit. Won't be an easy A, if anything a B- at best. Final is worth 40% of grade and is comprehensive."
1583600,N/A,Nicole,Kraus,0,0
1780396,5.0,Michael,Kraus,1,0.8752598481568378,"One of the best classes I have ever taken!!! Super fun, super friendly and super interesting, Dr.Kraus makes coming to class fun! Be warned, you do have to read a lot of articles, but other than that he is great!"
