194825,3.9,Tony,Liss,29,0.5308873964837995,ok,You don't have to go to class to get an A,He's a good professor who knows his stuff.  He's amusing and likes to joke around with his students.  The lectures are usually really helpful but so incredibly boring.,"Good professor, explains thing pretty well.  Lectures are pretty boring but they are usually helpful.  Homework, labs, and discussion quizzes are easy points and help with understanding the material.  Overall pretty easy course if you have any physics background.",Fun guy. Only real problem is his voice is kinda monotone so even if you're interested in the subject it's really easy to drift off. Some of the explanations can be a bit fast and probably are confusing if you don't know what's going on already.,"Class was really boring, stopped going after the first exam and saw no difference in my performance on homework, quizzes, and exams. He really likes demos, but he doesn't explain things well. When you ask him questions afterwards, he's sarcastic.","Very funny, great lecturer. He knows the material perfectly and enjoys teaching it. Material in 211 starts out easy, then gets hard, but he teaches it well enough.","He make Physics class so much fun, I like him","Great guy with dry humor. very likeable, but you have to study the lecture slides more than lectore notes in order to do well in the class, somewhat difficult","good lecturer. funny, good halftime shows. dont need to go to lecture everything in the notes.",Quality teacher; accessible.  Cares about the education of his students.  Uses the blackboard to derive important relationships which improves understanding.  Good lecture notes.,"Easily one of the best lecturers on campus. He'll keep your attention in lecture and his demos help you understand the material. Excellent online lecture notes. His exams are very comprehensive, but fair. I wish he taught other physics classes, too...","Good teacher, much better than the 212 one, plus hes pretty funny any makes it interesting.","Liss is a good professor, although I had a hard time in the class.  In his lectures, he isn't completely borring and his demos help you really learn what he is teaching.  The tests are a bit hard but if you study about a week in advance for them, you should be fine.","He's funny, but that doesn't help you learn the material.","He was very entertaining in lectures, but that didnt keep me from sleeping often.  The class is tough, but if you ask for help, he helps a lot, and it makes it much easier.","The demos and jokes in lecture were pretty good, but I would have benefitted more from a non-powerpoint style of teaching, maybe even non-lecture. Buy the lecture notes, not the textbook. The online homework is tough, so don't wait until 3am to start it.",Liss is awesome! He is very funny and intelligent and that makes him hot. hehe.,hes really funny. almost makes me wish i'd gone to lecture more often.,"I liked this class a whole lot.  Lecturing was good too, wish he was teaching 112+"
1133356,3.1,Jim,Lisy,5,0.40287993702180636,"Very competent professor, and very doable class. However, to be honest, his teaching could be better. Overall though, in terms of difficulty, it wasn't that bad, and from what I've heard, compared to previous 202/204 classes, this one is much easier. Doable, but could be better",he makes chem so much harder than it needs to be. I can see why hes good for higher level classes but not for intro classes. He blatantly refuses to alter his teaching methods to suit the needs and requests of the class. his tests are impossible. and he is very pompous. my opinion of him started high but got worse as the semester went on.,"Professor Lisy is a rather intelligent person and is very concerned with his students learning something.  He is very helpful if you ask him a question, and takes the extra time to explain WHY a theory works.  He never presents a concept without ample theoretical or mathmatical evidence.  However, he does come off as pompous in lecture.","Lisy is one of the most pompous professors that I have ever had the misfortune of dealing with, he over complicates things, he laughs at his students questions, lectures consist of him reading straight off of the power point, and he blatantly refuses to write on the board even after we requested it several times.  And his tests suck.","Excellent professor.  He's ridiculously smart, but doesn't flaunt it at you.  He knows his stuff, and can teach it to you.    No matter what your grade in the class, you're going to come out knowing soooo much material so well it's going to shock you.  I'd take any class from him in a heartbeat."
1470192,N/A,Bruce,Litchfield,0,0
1485421,N/A,"J, Bruce",Litchfield,0,0
1718364,5.0,Melissa,Littlefield,4,0.635791464415726,Overall just a cool chick!,She's a great professor and really cares about her students and is very helpful. This class was more like a book club for SciFi fans. The most days were open discussions. No tests and the 'papers' are easy and short and you get to chose between a few prompts. The final project is fun. Daily readings are all manageable with full schedule,"This class was a breeze, and Littlefield was really helpful. She was quite accommodating when there were technical problems, and really friendly in all her emails.","Melissa is such a cool woman... a SciFi nerd in the best way! She's really knowledgeable, has fascinating research interests, and does a great job of integrating writing advice into the general class discussion. My writing improved so much and she chose excellent readings. Take this course!"
800353,3.5,Chang,Liu,1,0.6990826467614513,This was a fun class!
1055021,4.2,Chih-Chung,Liu,2,0.7886846823497189,"A little hard to understand at first, but he definitely knows what he is talking about. He is extremely helpful if you go into office hours. He clearly tells you what he expects, and his expectations are very plausible. If you have trouble with accents he may not be your best choice though.","Great Teacher, using board effectively."
1509254,3.8,Jeffrey,Liu,3,0.493234010465134,definitely a nice person and an easy class. Choose his section if you have to take stat100.,I like him. He tried very hard and the lecture is easy to understand.,"Jeffrey seems really nice and he tries so hard to give you a ton of points. But the bottom line is that coming to his lecture mostly just confuses you more, even if you have had previous stats classes. Over the course of the semester I don't think it was possible for someone with no stats knowledge to pass the class the way he taught it. :("
1661507,N/A,Zhiwei,Liu,0,0
1945872,3.4,Lijun,Liu,4,0.49817612475106676,Awesome guy. Iclickers are graded lightly. One 5 question reading quiz each week and a handful of HWs. Straightforward tests- dropped one midterm. He is really understanding about iClickers. A few times he changed his PowerPoint on the spot to reword a confusing question. He stayed after to clarify lecture points and knows most students by name.,"Great professor. You can tell he is really passionate &amp; knowledgeable. iClickers/tests are really straightforward. Sometimes can be unclear during lecture but is enthusiastic when answering questions. People who can't understand him are sitting in the back, he is perfectly fine. Those who try to prove wrong are attempting to bend class to them","He's hard to understand, students often times prove him wrong. Iclickers are your attendance.  Online quizzes weekly.","He knows that GEOL 107 is taken by a bunch of engineers that are only taking it to satisfy electives so he goes easy on as he can on everyone .  Iclicker points are part of your grade and pretty easy, but sometimes he doesn't explain what the correct answer is which is kind of a pain, but overall he is a solid professor."
2015302,1.5,Yuk Tung,Liu,1,0.31558033171091415,His exams are way harder than hw.
2208223,2.0,Ji,Liu,2,0.4120034985629739,"So, Controls is a tough subject, but his teaching styles made it even worse. He is a very nice guy excluding his professorship, but if you really want to learn controls, you're gonna have to pretty much learn on your own with him as your prof.",Class is extremely disorganized and Ji Liu appears to not know much of what he is doing since he is a post-doc and not a professor.
2289751,N/A,Yunchuan Frank,Liu,0,0
1623219,1.9,Wen-Tso,Liu,6,0.34806007748495177,"He asks his phd student to teach most classes and invites guest speakers for the rest. Seems he was not the one preparing the lecture notes. Just sits with students, occasionally stops his phd student and makes wired comments.","A phd student was teaching most lectures. There were also guest speakers. The professor did not teach, just sits and learns with students. Sometimes he makes comments but hard to find relevant and useful. Wired is he does not allow auditing, saying the course is too difficult. There ends up to be only six students.","Apparently he did not prepare well for the course. The materials on the lecture notes are directly copy/paste from other textbooks and illogically organized. He also confuses himself in class... There were only four students taking the course, whereas more than 30 were taking the same course when another professor was the instructor.",He was not clear at many points in the class and confused everyone.,"He is definitely not for teaching. Most of his words in class are poorly organized and do not make any sense. He does not arrange office hours and even if you go to him, you don't get much useful. He might be expert at biology, but definitely not water treatment/engineering.",Prof. Liu is extremely helpful and accommodating.
1787156,4.5,Jonathan,Livengood,5,0.6721279394205054,"If you intend on taking and learning a 'tougher' level of philosophy such as PHIL 426, I strongly recommend Professor Livengood; he is a very supportive and passionate professor that makes himself largely available in order to ensure the student is learning well. I was very fond on how he gives students a large amount of autonomy in writing papers.",Good instructor. Pretty easy course but not so boring. Best Gened for engineering student.,Professor Livengood is one of the best professors I have ever had at UIUC. His passion for helping students is immense and he will literally spend hours with you if you need the help. For me personally the class was not simple but Livengood made it understandable by walking me through it.,"Excellent, excellent teacher. Intelligent, calm, helpful. Highly recommended. He challenges you and is crystal clear and organized. His textbook was overdue (exam came mostly from lecture slides... which were also overdue); he is still a one-of-a-kind, true TEACHER. So rare. Absolute 5.0. Class was thought-provoking.","Great professor, class was alright. He is terrible about putting things online but one of the most helpful teachers I have ever had at UIUC. I'd recommend this class if you want something that will make you think, but I don't believe it's an easy A."
1968177,5.0,Kerrith,Livengood,1,0.8395145028527915,"She usually teaches composition but I took her for music theory. She's pretty laid-back, has a good sense of humor, and likes her students. Your grade is split up a million different ways, so even if you don't do well on an exam you can make it up elsewhere. Also, a good amount of extra credit. FYI: textbook use was next-to-nothing."
1292557,3.0,Julia,Livingston,19,0.42816444961020655,"Easy grader, kept the class very interesting, and gives extra credit for attending every class.  If you put forth the effort you get an A easy as that","I thought this class had a lot of work. However, she isnt a harsh grader,she is pretty lenient as long as she knows you are trying. I didnt take the class very seriously and ended up with an A. Just make sure you are participating and putting in effort and she will reward you for showing up to class and trying. Its really not as bad as people say.","Way too much work, no room to write what you want, all environmentalism all the time","I'm a terrible writer and hate all types of english and writing. However, she made class rather interesting. Points are easy to come up with in this class, except for the three big papers, which are not all that bad. Finally, you can get a 1/3 grade letter boost by going to every class. That's not too shabby.","Lots of work, 5 essays and a group presentation at the end of the year. She's really nice but the class is boring.","She is a good teacher actually, she graded very hard, especially the citation, but overall is good. if you do every assignment, you will be fine.",Don't take her class!,"I failed the class when I took it with her. I took it again next semester and got an A. If you don't to the assignments exactly the way she wants you to, you should forget getting a good grade in this class. She is not open to writing styles different from hers and she is not flexible with assignment due dates.","I bet ""Class is only hard if you're an idiot"" has never done anything hard yet.  Because ""Class is only hard if you're an idiot"" is a real idiot.",Great Teacher!,"Good teacher, makes every assignment crystal clear. Class is only hard if you're an idiot. Bit of work required.",I actually loved Mrs. Livingston. I like that the points were spread across many different areas so if you aren't much of a paper writer there were chances in other areas to get points. She was helpful in office hours if you approached her with a question. I would recommend taking her class for Rhet 205.,AVOID AT ALL COSTS!!!!!this class is way too much work...,Every day need to write useless paper and only chatting on classes! Nothing useful you can learn from this class,"Her class involves way too much work.3 essays, 1 project, 16 journals, a grammar presentation &amp; 4 quizzes. She is also a pretty strict grader especially on the essays. However she is very helpful and replies promptly to emails. Still i'd never recommend this class purely due to the workload.",Her projects are very difficult to understand and she gets easily annoyed with questions.,avoid her at all cost unless you want a bad grade,No Comments,"She's not very clear, and she wants work done in her way.  Very expensive and useless textbooks, you don't learn much from them.  A LLLOT work required for a such easy class.  Her front teeth have blue colored stuff on them..."
2057953,4.2,Avital,Livny,16,0.5131369499860828,Prof Livny is such a good lecturer she points so much enthusiasm into lectures. She's very big on participation so you HAVE to go to lecture. There are a lot of online reading so if you print them out it becomes an expensive class. Her lectures go through everything in the readings but I still read them because she givesa gist of a 30 page reading.,Took her class as an easy gen ed and I wasn't disappointed. Just go to class and take notes and you'll be fine. One assignment every week that's super easy. She basically tells you what's on the test and really tries to look out for her students. She's incredibly nice and is always helpful. I recommend her completely.,"A very caring professor. She was very clear and understandable, considering that comparative politics can be a little difficult to grasp at first. Responds to emails quick and is very accessible outside of class. You can tell she wants you to do your best.","I absolutely loved having Prof. Livny this semester. Her enthusiasm is contagious and her personality made coming to class fun. She can be a bit slow with grading assignments, but the feedback is very useful when it does show up on Compass. Would highly recommend seeing her in office hours too -- they're helpful!","I did not have a good experience with Prof Livny. First, her lectures were boring. Second, she required participation, but then made me feel stupid when I spoke in class. She would also act like she was available to students ONLY when she was in front of the class. When I actually tried to talk to her one on one, she blew me off. Twice.","Incredible professor! Very attentive to students during lecture, wants participation and for the students to engage during lecture. Discussion is important and participation makes a chunk of your grade, but ultimately if you skim the readings and get the main points you'll be able to participate well. Funny, charismatic, intelligent.","To receive a good grade you would have to speak and answer questions out loud during a lecture that had at least 40 students in it. This requirement made students speak for half of the duration of lecture. By paying a lot of tuition money to attend lectures, I want to hear what the professor has to say about the subject, not other students.","She knows the topic, but the lectures are based largely on class discussion. This can be frustrating because she is trying to fish out the main points of the lecture from students, so it isn't quite clear what you should be writing down/studying. The tests are also a bit tricky.","Prof. Livny is an extremely knowledgable, successful woman, an amazing speaker, and a down to earth person. I took PS 152 as a GenED knowing little about the topic and could not be happier about how much I've learned from her. She's always prepared and makes everything interesting. She also always does her best to respond to what students need!",Professor Livny is a great teacher who really cares about her students. She wants everyone to succeed and learn the material instead of just teaching for the test. I would love to take a class from her again in the future.,"No textbook but required readings.  Every week there are reading questions worth 40% of grade. She is a fun lecturer and there is participation for going, but I skipped class a bunch and was fine. Grade depends on TA. Livny is adorable and really cares about the students.","Livny is super knowledgeable and her lectures were engaging. Lots of interesting material, cool visualized data. Grades were made up of weekly reading quizzes, two exams &amp; participation. Some ppl here mentioned long readings; but remember she never expected us to read every single page - selective, strategic reading will do. You'll learn a lot!","Her PS199 class was a bit too difficult for freshman. There was A LOT OF papers to read, but you really get a good sense of what real political science is about. Also she explains pretty well during class, and the class is very interesting! Seriously considering doing PS grad school after taking her class.",She took forever to grade papers. Lectures and notes were very clear. Really nice and great to talk to.,"While Prof Livny is a very knowledgeable person, I feel like the readings she gave for this specific class were very tiring. They were too long which lost me at times as a student. The concepts and lessons were always very interesting but homework was nothing to I ever looked forward too. Not a bad class at all.","Professor Livny is great. She's very intelligent, well-spoken and passionate about the Middle East. You get 8 options of assignments and only have to do 4, and then one paper at the end of the class. Her class is focused on research methods with broad themes, rather than specific info, so just know that going in."
1411689,4.0,Alejandro,Lleras,3,0.23149254041960277,He's really chill and wants to make class the same way - easy A. His class has 3 Exams(60%) + 9 easy quizzes online ( 10%) + 3 discussion post online (one per test - you just answer a question in a short paragraph 20% - very lenient with grading) Only complaint - Attendance was mandatory with iclicker (don't even need to get answer right 10%).,"The class is relatively easy, which is good because he is a tad hard to understand every now and then. I didn't use the textbook much at all - just attending lecture was good enough for me, as long as I paid attention. Only exams, no homework or papers to write. He's a very likeable professor!","Only 3 exams, non cummulative. No lecture participation and I recieved an 89% by just using the lecture slides. TAKE THIS CLASS!"
1467933,3.9,Nick,Llewellyn,19,0.5286539105378171,Good teacher overall,"The material was difficult, especially because we were expected to learn based off youtube videos.  But, if you went to Llewellyn for help, you could tell that he knew the material very well, and was able to explain it pretty clearly.  Definitely go in for help!","All material given in this class is all online through online webcasts and online discussions. The online webcasts are average and the discussions are all taught by TAs who are inconsistent. First exam material is the easiest, while the second is hard. Curves are very generous though. Keep up and do all of the given practice and go to office hours!","While this course may be difficult to keep up with since all lectures are online, with enough studying(about 10-20 hours/week), it is not difficult to do well in the class. Go to office hours as often as possible, and keep up with POTDs. Good luck!","Just keep up, and it's really pretty easy. Watch video lectures seriously for the 30 minute span. Do the practice problems sometime before the test. and work on quizzes with friends. Curves are super super generous. Very possible to get an A in this class. If you get the hang of it, it's pretty easy to grasp all concepts. All self motivated.","This class is all online. It's a lot of self discipline because you technically do not have to attend lecture... If you keep up and do all the POTD's, quizzes, and mock exams he gives out, I think that it is all shown fairly on the test. Dr. Nick is one of the best professors I've ever had.","I hate organic chemistry, and it's really stupid that the class is online.  The professor doesn't even have a lecture.","This class has a lot of resources for students who are struggling, and there's a grading exception to help students who are struggling early on in the course. Even though it isn't easy, it isn't terribly difficult if you pay attention. By the end of the class, you can solve almost any mechanism you look at using the tools you acquire.",Orgo is hard. And it's a mess at U of I because it's online. You have to do everything you possibly can to understand because the lecture videos are unclear and oversimplify the mechanisms. I found the POTDs were too easy compared to the quizzes and exams. VERY generous curve. Do all your work so you can use final modifier. Otherwise you're screwed,"REally helpful professor. Listen to his online discussion, much better than the TA led ones. GO TO OFFICE HOURS!!!","Nice professor; generous curve; useful resources. He is always ready to help you whatever via email or office hrs. KEEP IN MIND!!! do you quiz problems with study group, go to SI at least onece a week, it is not that hard to get A.","Probably the hardest class I've taken in my three years at U of I. However, Dr. Nick is a great professor. Discussions are very helpful, as are the (optional) homework problems. Grade consists of weekly quizzes, three midterms and a final. Effort is essential to success.","Yes, there are weeks where you have to put in 15+ hours, welcome to college. Dr. Nick does a great job in debunking the funk of organic chemistry. There are tons of resources available, he archives all of his online discussion sessions, and his curves are always fair. Best chemistry teach I've had so far, highly recommended.","Well, he is nice. Just homework, quiz, and exams are way beyond the lecture's material. Do not expect a good grade unless you spend 15hrs per week on CHEM 232 only.","You have no idea about this class. Extremely harder, if you want to get B+ or better. 2 hr per day, not include discussion , online video, SI.","In the beginning, I didn't really try hard in this class and that was a BIG mistake. But towards the end, I studied really hard and I began to understand everything. He's a GREAT professor. So good at teaching in my opinion. DO NOT slack off and go to discussions! Work really hard from the beginning and you'll do fine.",,"I thought his tests were really fair. He gave curves for each exam which were very generous. He always held exam reviews. Class is a lot of work and effort is key to success. His final was a great representation of the ""mock exam"" Great professor","Wow..If you wanna take a class that makes you hate your life I highly insist Orgo with Llewellyn. His tests are redic and barely reflect lecture material. He def assumes everyone is a chem major and loves the stuff. Having the class and all materials online though is pretty nice, but not worth the redic expectations"
1551207,4.0,Nicholas,Llewelyn,1,0.36101996294031463,"Organic chemistry is not easy. Go to discussion. Go to office hours. Do everything you possibly can to get ready for each and every test. Even then, you still might not be ready. Llewelyn likes to make tricky exams and they get pretty hard. RZBP always helps too."
