1636624,1.9,Sheldon,Jacobson,16,0.3746311074149016,"The lectures are related to the material, but he is not a good lecturer. He would berate students in class for asking questions or for wrong answers. If you take this class, you'll have to learn from the textbook and other resources.","No textbook, slides are horrible, exams are worth 65% so there is really nowhere to study.",Bad at lecturing. Not Willing to help. Even if you were to break your arm he will not give a make up or conflict exam.,"Not particularly helpful or caring towards students, bonus points are awarded arbitrarily and unpredictably. Gives no extra preparation material for exams. Interesting project, but get ready to memorize slides to pass.",Really good course!,"You have to know what you're getting into, but if you accept it you'll do fine. Tests are usually based off of homework or lecture examples, but still are very hard. Always attend class. Always. ALWAYS. Even when it's optional (which it always is). You can get crazy extra credit for attending certain ones.","Extra credit doesn't necessarily mean good. He gave a pop quiz for extra credit, up to 12% added to your final grade if you do correctly or 6%deducted.3 ppl out of 80 turned the quiz in.  Instructed the TA's to not help us with the final project during office hours. In general, you have to learn everything on your own.","non-mandatory attendance is not really non-mandatory. he gave extra credit to people who attended after saying that the material will not be included in the final. really bad communicator, forms bitter relationships with students. if you do not do things his way, he will do his best to make the course a nightmare for you. not a very likable person.",Really didn't learn anything from class.  Made the last 2 weeks optional and then gave out over 10% extra credit to the overall final grade to the few students who showed up.  One of the worst teachers I've ever had.,"Horrible. Holds grudges and forms bitter relationship towards students due to low midterm class average. If we failed your midterm, it means we need more help and guidance professor, not punishment.","This professor is a child. He simply got really mad at how everyone did bad on the midterm and does not show up for class, so he just made up really childish punishments for people who dont show up. He penalized the people who didnt show up by giving out extra grades and letting people know about the index card in class. Needs to mature. Seriously.","So basically, this class is a required class for the FALL semester for IE students, during your senior year. So basically, if you do not pass this course, you are most likely to take this class the next year, unable to graduate on time. Also, the tests are seriously difficult, without given partial credits. If you have this professor, then pray.","I personally think that this is not a hard course like everyone else complaining about. If you show up to the class and start studying two days before the exam, then exam is very straight forward, slightly modified from lecture note problems.  All you need to do is show up to lectures and take notes on what he says it will be on the exam.","Toughest class I have taken! Confusing materials, unclear lectures and the exams are a nightmare! Material starts out being interesting but it becomes very difficult to grasp soon.","I think that IE310 as a prerequisite is not helpful at all. Professor explains as if everyone should know the stuff he teaches. Power point is the only thing he goes over, no other references. The book has no diagrams or whatsoever. The class doesn't teach you probability models. You just have to know all this before you take the class.",Great professor.  Funny guy.  Keeps topic interesting. enthusiastic
720906,4.8,F,Jaher,2,0.6765612533038138,My favorite teacher ever at U of I...Totally cool; i miss him so much!,"A great man! Informal, interesting, a large selection of books in the syllabus."
1960639,3.3,Diana,Jaher,6,0.4865869081934539,"If you have ever taken MACS 261, this class structure was almost identical. You watch films during class and then she gives a lecture about it. She knows what she is talking about and has a great deal of knowledge about films you watch. Overall interesting and easy class!","She's overall a great professor. Her instructions are typically easy to follow and the tests are all open notes, so going to class which is mandatory helps so you can take good notes. She also doesn't mind if you take pictures of the slides.  The essays were the only things that were difficult to do really well on.","She's really strict on attendance, but I think it's worth going to class because that way you can get notes from the lecture and you can use all your notes on the exams. She knows what's she's talking about and because of that, she grades hard since she knows her stuff and also because she's watched, like, all the films you'll probably write about","Diana is a great lecturer and always has intriguing notes. Her grading is very hard, but there are only two papers, a midterm, and a final, so not much time is spent on homework or studying. She docks grade if you miss more than 3 classes, so be sure to show up. Movies she chose were very good and she knew a lot of information about them.","While the midterm and final was open note, she's a super difficult grader and is completely unclear about what is required for the two assigned papers. On the first, she allows rewrites, but she makes things so much more difficult than necessary which is super annoying. More trouble than it's worth.","Only the final and 3 papers. She was a pretty hard grader, but the final is open note. Long lectures for the screenings, which were also late at night. Attendance was mandatory and taken every class period. She zooms through slides and doesn't post them online. Very nice, but the class was harder than it needed to be. She has an IMDB page!"
1985605,4.5,Ankit,Jain,1,0.47157747154581536,"This guy was so excited, that sometimes I felt like he needed to calm down. He was a great TA for my Senior Design project, and made my group think and work a lot to get the job done. He doesn't make it easy, but he does everything he can to make it worth it."
2158110,N/A,Prashant,Jain,0,0
2374060,N/A,Atul,Jain,0,0
894758,4.9,Abhishek,Jalan,5,0.627852783840592,"He is a great TA, loved his class and he was very helpful. You should def. take his section.",Good Stuff,Excellent class had an amazing time.,No Comments,No Comments
835530,N/A,Kevin,James,0,0
1591273,4.2,Rory,James,4,0.43018537299248955,Easy,"Easy A! The class could be a lot more fun if whites/Asians/Hispanics etc were in it. Easy assignments. Have to read two easy books, but we go over them in class. Got to connect with other people too. Cool class.","I love this class! It's soooo easy! We only meet once a week, and we only have to dress up like 3-5 times during the semester. You'll get to connect with other students (mostly black), but people from other races actually make the class a lot more interesting! It's an easy A, and offers over 150 extra credit points! (you can't beat that). Take it!",WORST CLASS EVER. PROFESSOR IS UNORGANIZED. ASSIGNMENTS ARE MEANINGLESS TO THE CLASS. UNFAIR GRADER. BORING. MAKES STUDENTS DRESS UP FOR CLASS ON RANDOM DAYS. QUIZZES AND TESTS BASED OFF CONTEMPORARY AFRICAN AMERICAN MOVIES. I DO NOT RECOMMEND.
2069327,3.5,Kai,James,1,0.5839046874667453,"He was a good professor, especially for this first time teaching. Comes to class late the second half of the semester and kept us late, which was a little annoying. Otherwise, he did a great job and I feel like I understood the material better than students who took the course the year or two prior."
1758513,1.6,Daniel,Jamieson,38,0.284321873005248,"The amount of homework, quizzes, papers is humanly impossible to complete. On top of that, his test is extremely extensive and with questions far too advanced compared to what we leaned in class or trained for.","Jamieson flat out sucks at teaching. He would teach a lesson and you would leave even more confused than when you first started. Even as you gained even a tiny bit of understanding, he would shoot that to hell on homework assignments and exams. He always looked just as irritated with us and we did with him.","I usually like chemistry, and I got an A in the class before with Hummel. He is terrible, and the tests don't relate at all to what was actually taught, which is practically nothing.","I think I went to lecture less than 5 times during the whole semester. He spent more than 30 minutes solving a problem I could solve in 5 minutes. Also, he doesn't believe in Powerpoints, which sucks. His exams are easy compared to other professors' exams though. If you can, choose him and go to other instructor's lectures.","Honestly, I'd heard bad things about Jamieson, but I couldn't take the class with another professor, so I was stuck. And boy was it awful. We just dove into topics without any explanation as to why we were doing so. There is no point to going to lecture. I was in merit as well, and that was the only place I learned anything. Avoid him at all costs.",just a bad professor. pretty much all his other reviews describe his class to a T. terrible at explaining anything. horrendous lectures.,"He tried to teach chemistry but it quickly turned into a burning inferno of terror. His first exam was decent and then it crashed and burned, the final being almost impossible. He seems really nice, just not a good teacher.",Why is this man still teaching?,He's really a difficult teacher. He is inconsistent with what he says and this only makes this course even more difficult. This was his first semester teaching this course but i can only hope it's his last. AVOID HIM!!,"Avoid at all cost. As a chem major I am expecting difficult, but he dives head first into things with zero explanation leaving you absolutely clueless. Terrible teacher. Everything is learned on your own time and lectures literally unteach many of the things you manage to teach yourself.","I've had Jamieson for two semesters now, and whilst I still find his courses difficult, I must admit that his teaching practices have improved markedly since last semester. Not to mention he's also a good sense of humor and tries to make everybody feel welcome. Give him time.","I major in Chemical Engineering and did pretty well in chem102; however after taking Jamieson's class, I lose all my interest of learning chemistry!!!!!","I found his class challenging, but I went to his office hours and asked many questions. Some of the test questions aren't very clear though...",Worst teacher I have ever have or probably ever will. I took this same class in high school and he actually unwound the understanding I had of the material. He is the antiteacher. If you are unlucky enough to have him as a professor do not go to lecture especially if you have previous knowledge of the material. Tests are designed extremely poor.,PowerPoint presentations are disappointing and disjointed he doesn't provide much background before launching into something. Doesn't seem to have a well prepared and clearly written out presentation prior to giving lecture.,"Very bad professor, if you manage to stay awake in his lectures, all you will learn is an oversimplified version of the material. He makes mistakes on examples, is rarely prepared for class, and fails a very high level of students.",He is so far behind its not hard to keep up and learn everything. plus he just uses problems straight from old tests so its not hard to know whats on his tests.,Do not take. You will have a bad time.,I can't believe is getting away with failing us when we learned everything ourselves,"Brutally bad professor. We've fallen so far behind the syllabus that we had to teach ourselves two chapters that we were still tested on, and we're still not going to finish two more of the chapters we were supposed to. Just a bad presenter, terribly unentertaining, and still makes tough tests with little to no curve. Avoid him at all costs."
537436,3.2,Prabhu,Janakiraman,4,0.3299176589275403,Prabhu is the worst teacher. His tests are unfair and he changed the syllabus 11 weeks into the semester. I recommend going to office hours because he will do all of your homework for you even you don't learn anything.,"Real Analysis is a tough, tough course no matter who you take it from. Prahbu is a distant-type who may not seem warm at first, but once you get to know him is VERY helpful. Make sure you go to office hours and study. I learned a lot from him, and if you care about the class you will do well. Don't be intimidated by the exams, and do your homework.",No Comments,"I thought I failed this class but ended up getting a B+.  I think there must have been a massive curve.  I didn't really like his presentation of the material, but I guess everything turned out ok in the end."
2267075,4.0,Hansol,Jang,1,0.7733042975721829,I took ACCY 312 with Hansol when he was a PhD student during summer of 2017. He's good at explaining tax in spite of the dry material. He's good at giving examples for different situations and relates his personal experiences to each policy.  He's clear on what will be on quizzes and exams and is lenient on grading. Read the book and his slides.
1261183,3.2,Phil,Janowicz,10,0.3843649315105537,Oh my god Phil was the bestest! He was funny and sweet and best of all he had the worlds best hair! Never has the 'shaggy dog' been pulled off better than by Phil!! :D,"Phil wasn't help full at all.  At the time of my enrollment in the class, he was calling himself DR. PHIL, and he hadn't even passed his PHD defense.  He didn't do anything and just let the TAs do all of the work.  He was very snotty and nasty in his emails, and they came off very unprofessional.","phil was great and expected a lot from students. If you used all the resources that he organized and provided, the class was easy and managable. If you expect to BS your way through and not give it any effort, you will probably not do so great. Phil was always there and open for questions if you needed help",He was completely useless. He offered 4 exam times for each of the three exams for the semester but never changed any of the 4 so the avgs. for the people who took the test on the first day were so much lower than people that took the same test the second day. People cheated their way through this class and he did nothing about it. He was awful.,"Phil sits behind his computer &amp; lets TA/SI leaders run the show.Dr.Moore/TAs do online lectures,SIs teach in discussions; where's phil? Only thing he does is make exams with a D- avg; he caught 19 cheaters so he made 4 dif finals with a D-avg. Thanks for nothing, phil. My B+ is from teaching myself &amp; having a good SI leader.",Phil should not be considered a professor. He does not give even give lectures. At least when Moore taught this class there was the option of seeing the professor face to face three times a week. Phil is completely absent,"Phil...who is he?  He is our ""professor"" but I've literally seen the guy maybe twice all semester.  He is a joke and basically, he doesn't teach the class.  No one teaches the class...it's a free-for-all that you have to figure out on your own.  That's great and all, but when there is NO feedback from your ACTUAL professor...it gets aggravating.","While organic chemistry can be very difficult, it was awesome having someone like Phil to teach it.  Not only is he really smart, nice, and helpful, he's also hot!  Definitely recommended.",No Comments,explains everything well and there's no one who cares more about students than phil. he's tough and expects a lot but i learned so much from him because of it.  definitely take this course online because it's way better online than on paper.  i actually get biochem now!
2068208,3.7,Juan,Jaramillo Jimenez,6,0.5200889892916446,"He's kinda weird, but I enjoyed this class a lot, it was taught well. All professors for this class are great. Actually put effort into Labs and Homework and test should come naturally. A lot of people copied on Homework, and it cost them on test.",Hes sassy and explains pretty well,"Prof. Jaramillo is the type of professor to care a lot about you if you care a lot about his class. If you ask questions during lecture he takes the time to learn your name on the roster. He made ECE 120 very enjoyable for me, and his lectures were very clear. I wish I could take more of his classes!","Prof. Jiminez is one of my favorite, if not my favorite, lecturer on campus. His lectures are enjoyable, understandable, and cover all necessary subjects. It is true he moves quickly, but this allows him to cover the material in more detail. Whether or not this is a positive thing is purely opinion, but it's something I valued myself.",Treats students like they're dumb if they don't immediately understand a topic. Makes you feel bad for not getting something. Sorry we're not all as intelligent as you.,"Great lecturer but can be slightly intimidating, especially at his office hours. Class is very rigidly structured and protocol-bound. Go to class on time and take lots of notes or you will not pass; the guy covers miles in a very short amount of time, and everything, *everything* is fair game on the tests. You dont need the textbook."
1745744,5.0,Alan,Jarman,9,0.7288099869467454,"Extremely cool TA. He makes the best jokes that really complement the learning. Also, he is pretty charming &lt;3",Great TA! Very helpful and friendly! Made this class very enjoyable!,"Professor Jarman is HONestly the best TA I have EVER had through out college. He has helped me with just about any questions, even about my PSR. If that's not enough reason to take his class, he is also attractive and cute. I actually had bad expectations of this class due to what others told me, but Alan really helped spark interest in anatomy.","Honestly, one of the best TA's that you will ever have. Always willing to help you no matter what.","Awesome T.A. Didn't seem like he knew much in the beginning, but he is definitely on top of his game now. Really good looking too.","Alan was great!!! He made the class so much fun (his jokes are memorable), and was great at helping and teaching us! He is extremely kind, and very cute lol. If you get the chance, you should definitely take him!","Such a sweet TA!  Wasn't that interested in the subject prior to attending the class, but somehow Professor Jarman makes the class so enjoyable!  If you have any questions, he is extremely helpful during his office hours, especially if it's one hon one. The bonus is that he is pretty attractive too =).  Alan's TA section is a must!","Alan was really nice to everyone in class, and he's really cute too!!! &lt;3",Great TA. Great sense of humor. Also has an amazing Baron Davis-esque beard!
1875993,2.5,Robin,Jarrett,2,0.5304603386325697,AVOID AT ALL COSTS!,AMAZING PROFESSOR. SHE IS VERY KNOWLEDGEABLE AND HELPFUL. YOU LEARN ALOT ABOUT AFRICAN AMERICAN FAMILIES IN THIS COURSE.
1824448,1.8,Iwona,Jasiuk,4,0.3485297244274588,"Well, the lecture part of this class was a complete joke, as the quizzes and tests were almost identical to the homework and practice tests. I could appreciate the easiness of the exams/quizzes if I felt like I actually learned something from attending the lectures. Be prepared for a snoozefest and a lot of self-learning and memorization.",Rambles on and  on and whips through lecture slides. very boring.,"In class quizzes &amp; hw due alternate days so attendance is req but punctuality is not. Not an exciting prof, but does a good job. Take good notes! With a little help from the book the hw is not too difficult 0.5-4 hrs/wk, avg 1.5 hrs/wk. Quiz very easy, test (2)/final moderate; DO THE HW+BOOK PROBLEMS and understand them and the tests become simple.","She is a nice person, but a terrible teacher. Better count on books for learning the material. Exams and quizzes are quite easy so nothing to worry about."
1749451,3.8,Jill,Jegerski,5,0.6096151127135351,"She's alright. She's nice and will help if you need it, but she isn't engaging at all, which is important in a language-learning class, unfortunately. Doesn't encourage you to speak Spanish and is a very easy grader. Plus, half the course is online. As long as you do the minimum you'll pass. It's not a fun class, but the material is interesting.",Super nice and is always willing to help you if you need it,"The class was hard and she didn't explain things well, but she was a nice person at least.",She is highly interesting and presents the material in a easy to comprehend manner.,"Class started out interesting and easy, but we were taught the WRONG way to structure sentences and then taught the RIGHT way. More time could have been spent on this, which is what we were tested on, rather than on redundant examples. Class was very easy up until the very end where it became out of control trying to learn the new material."
2422455,3.5,Petra,Jelinek,2,0.5116424309879448,Partial online and lecture. Taught by TAs. Attendance is not mandatory but there can be surprise extra credits during the discussion section that is only earned if you show up that day. 1 or 2 assignments per week. Easy A.,"If the class is taken online, go to the discussion solely for extra credit(which is recommend). The TAs grade your PBLS as if you were majoring in anthropology which isn't fair to a student solely taking the class as a gen ed. The quizzes are very hard, you must read all the reading its not just general information that you can find on the internet"
846602,4.4,Christine,Jenkins,4,0.4440224489343097,Assignments were not graded in a timely fashion.  There was only one grade in the grade book by the end of the course. I felt that this was ridiculous due to the fact that there was a TA in this course.   I have no idea how college professors are able to get away with this as high school teachers never would.,"Many books to read. Too many students in the course. Good website assignment although demanding. Little diversity in selected texts. I recommend taking the course for 2 credits, not 4.",I love Christine!  I wish I could take one of her classes every semester.  She makes class fun.,"Take any class you can get with ProfCAJ - she is extraordinary. The workload is not light, but you will learn a ton. She is passionate about youth librarianship, and you will become so too, after taking a class with her."
1280673,3.6,Richard,Jenkins,4,0.40282942550017753,"Interesting subject and he seems to know the material very well, but he doesn't seem to really know how to teach. Don't think he's actually even a professor... Class structure did not make a lot of sense, learning objectives never clearly articulated","Great sense of humor, insightful commentary, and a pretty well run class. I felt it was very worthwhile. A lot depends on TAs though - you'll interact far more with them.","I thought this class would be interesting, but it was the opposite to what I expected. Expect to read a full length novel weekly...every week for the entire semester. I learned nothing about German popular culture.","He's a nice guy, but I feel like he has no idea how to teach.  Couldn't keep to the syllabus and didn't really know how a classroom is supposed to work"
2084904,5.0,Candice,Jenkins,1,0.866721737169814,"I love Professor Jenkins. Her enthusiasm to read each book with the students (regardless of how many times she has taught the class) helps to improve the engagement in the course. While there were many books assigned (6-8), they were fun and humorous and relatable. Professor Jenkins is easy to approach and incredibly fun."
800853,3.7,John,Jennings,8,0.6150845783035417,"Super laid back, doesnt really give lectures just assignments. nothing graded til end no work is hung or critiqued as a class. but chill guy. hardly comes to class",Interesting guy and has a really great sense of art. Good with collaborations or helping you flesh out your ideas. Cancels class all the time and is pretty disorganized so... make of that what you will lol.,"interesting person, very liberal(in the classroom and elsewhere), and frequently cancels class","I LOVE PROFESSOR JENNINGS. he has so much talent and so much to teach, it's amazing. Very friendly and open to your ideas.","John is a chill professor, who looks for spontaneity and creativity in his student's work. A typical critique comment would be ""that just, doesn't flow, you know what I mean?"" He is not very precise or anal about design--he just wants it to look good. If you're searching for hard criticism, he is not for you! Try Daniel Goscha or Jennifer Gunji.",Ready to help in any way he can. Expectations set just right. Fun projects with extreme freedom.,"Fun guy who suggests creative projects. Class is a little disorganized, so keep track of your old stuff because it'll pop up again in the last week of the semester. Loves comic books more than any human on earth.",John is a great guy.  He helps improve you in any way possible.  He is the kind of person who would give their shirt off their back for you.  His insight into Hip Hop is useful with Graphic Deisgn Skills.  Not an easy grade but A-B range if you put effort into the class.  I HIGHLY recommend taking ANY of his classes just to experience his style.
1722656,N/A,Melinda,Jensen,0,0
