1832200,2.8,Svetlana,Lazebnik,7,0.45533580981480537,One of the best professors that I have ever met!,Class covers some extremely interesting concepts. Svetlana does a piss poor job of explaining them in lecture. Her lecture slides consist of condensed material from a textbook and she literally reads the slides aloud in class. There are no explanations nor any followup discussions apart from the ones she prepares beforehand.,She is clear and consistent with her lectures. Materials are interesting.,Excellent preparation and time management. She is a very sincere professor and the best I've ever had.,Quite a poor professor. She has interesting research but has no clue how to properly lecture. Slides are verbatim from the book as are the exams. Does not help at office hours and has a terrible laugh. Keeps track of students attendance mentallyand calls you by name. Awkward.,"Terrible professor. Boring lectures, unhelpful in office hours, exams are entirely memorization.","Very boring lectures, slides are a condensed version of relevant book chapters, graded class participation, exam is entirely memorization, unhelpful TAs"
149869,2.6,James,Leake,57,0.25766137496494645,"He makes you buy his book, which was so not worth money and he is also a VERY boring lecturer. I mean, it is almost mind-numbingly boring. He has a very monotonic voice and is passionate about the subject, but not in a way that makes people want to listen to what he is saying. He is very nice though, and when I talked to him alone, he was helpful.","He isn't the most interesting lecturer, but he knows his stuff and is willing to answer questions. Attendance is taken via a sign-in sheet that you initial. There isn't too much work in the class at first but as time goes on work intensifies, culminating in the design project which takes hours and hours of work. He will help you, though.","His lectures are kinda boring and he speaks with a monotone voice. He knows his stuff, but the delivery is not so good. He wrote the textbook so everything can be found in there. The modeling assignments are pretty easy, the sketching assignments are not hard, but time consuming. Start the group project early!!!!",This class is extremely tedious and time consuming. It's only offered for 3 credit hours which is far less than what it should be. The TAs can be pretty helpful but Leake's lectures are extremely long and boring. It's hard not to fall asleep unless you're very interested in the subject. Be prepared to do a lot of tedious work.,"Guys, start the design project early if you're in CEE.  As far as Leake, he knows his stuff, but the delivery is pretty boring and he isn't nearly as involved as he should be.","If you can get past the boring delivery, he actually explains the material pretty well.  Start the design project early.  On the last week, I spent 4-5 hours a few days in a row fixing parts and working on the assembly.  Exams are relatively easy, but you do have to know the material well enough to be able to work quickly",You're most likely taking this class a requirement and there's no avoiding Leake. Therefore just accept the facts of the class: There are frequent sketching assignments that are graded hard but if you put in effort they are fine. Then the tests are taken directly from his book so if you study it exactly the few nights before you should be fine.,"If you have to take the class, make sure you pay attention to your assignments posted on Compass. The design project will take up a huge chunk of your time, so make sure you know what you need to do ahead of time. Lectures are boring, hopefully you get a good TA as they end up being the people who grade everything and can help you on modeling.","He has repeatedly cancelled assignments, then at the last minute required it again. We were tested on material we were not taught nor told we had to know it. Points were taken off assignments if we didn't write our name in all caps. When our TA was asked if the information was even useful, he said no. Also we had to the useless textbook he wrote.","This class is not really helpful. I am not going to lie, I did enjoy learning how to use Autodesk Inventor but the sketching stuff was pointless. Not only did they hurt my grade but I never need to use it in my life. This class was not worth all the hours i put in. Also the prof. is really boring. His lectures are pointless and his tests are hard.","Most boring lectures ever. But, if you take notes it will help out in the long run. Also, read the texts.",he sucks at teaching! and he hates his students! extremely boring lecture and tons of assignments dues every week and he never teach.,"Easily the most ineffective professor I've had at UIUC. His lectures provide no insight into the material, or the slightest notion of enthusiasm. The majority of this class is taught by the TAs who struggle to keep up with his disorganized scheduling and thought processes. Do yourself a big favor and start the design project ASAP.","Leake is a sad man.  He hates his job and he hates teaching, that much is obvious.  #1 problem with the class is lack of organization and scheduling.  Due dates are revealed a few days before the date (even on major assignments), directions are cryptic and sometimes irrelevant.  Just get your project moded ASAP because it WILL be due unexpectedly!!","Boring lecture, no denying that. Interesting course material. Good ONLY if you like spatial visualization.",He didn't keep anyone interested in the material. He was very boring. The written exams definitely weren't easy either. A lot of work required for the class as well.,"This class is extremely boring. I am a CEE major and this class has nothing to do with my major. This is completely useless. Not to mention his monotone, dull and boring voice.","I had his lecture at 10 and still fell asleep in class. I had to go since he took attendance. Exams are heavily dependent on the tedious textbook he wrote. I still remember how the book said an advantage of using a mechanical pencil is the fact that you don't have to sharpen it. Also, it advised to use an eraser that won't smudge. Still, an easy A.","More than half of the students in lecture are either not paying attention or sleeping, but he has no one to blame but himself. He is lazy, boring, and doesn't seem to care about the students understanding of the material. It is not a terribly hard class, but it's certainly not an enjoyable one.","Very,very boring. This class is hard if you do not have good visualization skills. Lectures are pointless to go to. Get started early on the design project even tho I know you won't. For the written tests,read directly out of the book because he wrote it."
734032,1.8,Jim,Leake,10,0.3335756023905435,He's so boring that it's nearly impossible to pay attention for the the whole lecture. The written exams are extremely difficult and the material on them is only covered in the lecture. A TA said they were specifically designed to lower the class average. Leake seems genuinely interested in the subject and like an ok dude but the class sucks.,"He is easily the most boring professor I have ever had. It is a shame because the class content could be really fun and interesting, but his dry character sucks all of that enthusiasm right out of the course. He spends half of each lecture explaining what he is going to talk about during lecture, aight? Not good.",I have never worked harder at a 100 level class in my life. Lectures are mandatory and you will fall asleep due to the dry monotone that persists for 50 minutes.,"No question, he is boring. However, if you go to class, and study hard for exams and learn autocad stuff,you should be fine. True, course requires a lot of different kind of work: 2 written exams, 2 autodesk exams, project, etc",Most useless class I have ever taken.  He can't teach.,"What did UIUC expect when they made a course that combined 3D Auto CAD, Inventor, hand sketching, learning about perspective and a bad professor who runs a racket selling his textbook to the class every semester? Clearly it is not working, because they try to teach you too much and not much sticks.","Very Boring.  Does not teach the class well at all.  Avoid taking the class at all costs.  It is extremely boring and requires a lot of work.  Plus, most of his TAs can't speak English.","I think he's a robot. When I wasn't fighting sleep, I thought his teaching abilities were par, at best.  Book readings weren't helpful.  Thank goodness for my awesome TA.  Leake's class notes online are pretty good to study from, however.  Otherwise zzzzzzzz.",ZZZZZZZZZzzzzzzzzzzZZZZZZZZZZzzzzzzzzzzzz,"If you're having problems with insomia, come to GE 101 lecture. You are sure to fall asleep within a matter of 32 seconds."
1466252,3.0,John,Leap,1,0.3194344089255581,"He was a pretty good teacher.  There were a few times he got lost in proofs (which he does a lot of, but I found most of them helpful) and then he would assign finishing them as homework, but it was pretty tough.  The homework is more difficult than the tests.  I would give him a B+ as a teacher, which is coincidentally what I got in the class."
2067904,N/A,Yvonne,Learmonth,0,0
1366448,2.8,Jiri,Lebl,3,0.551539002965177,"He's an evil genius who can program anything. He teaches from his own notes which can be confusing at times, and his examples are sometimes hard to follow, but once you've learned to solve one problem, every problem you see after that you can pretty much solve the same way. If you can remember the procedure for a few types of problems, you're fine.","The first half of the semester is easy, but it quickly turns into arbitrary calculations that are needlessly complicated.  He uses his own book which is nice to not have to buy, but can be extremely cryptic.  If you are very skilled in math you'll be fine, but he can be extremely hard to learn from if you have no exposure to the material beforehand",
892990,2.2,Georgepierre,Lebron,15,0.4137912952814874,"His prompts for paper and tests (which include very lengthy essay questions) make no sense.  Instead of simply asking what he wants you to answer he tries to sound intelligent and gets overly wordy. When you ask what it means he acts like you are incompetent and gives you an answer to ""clarify"" which makes no more sense than the initial prompt.","Likes movies, but is very rude and blunt when you give your opinion, which is discouraging in discussions. Tests and work are impossible to study for as he wants you to somehow read his mind, which makes his grading seem arbitrary. He also goes off on confusing tangents. Basically expects you to think like he does to get a good grade.","Unless you have a true passion for the class, I would drop if you are assigned him.","WORST TEACHER I'VE EVER HAD MY ENTIRE LIFE. He was disorganized, mean, rude, tough grader, unclear, and overall not a good teacher. I don't understand why he even taught the class, he seemed to hate everyone everyone in our class. I wish I had had a different TA because he made the class difficult, boring, and stressful when it didn't need to be.","Great Professor. Extremely brilliant. Tough class, but I'm happy I had him.",He is terrible! The worst teacher I've had at U of I. He never tells you what's actually on the test or what he wants from you and he's a hard grader too. He expects you to read his mind and is a total crazy. DO NOT take his class.,"the guys seems like he would be cool guy to talk to about movies and such, but he's not a good teacher. his tests are too long to finish in the time period given. his instructions on the papers do not give a clear picture of what he wants us to do. class can be interesting from time to time, but its difficult to get though.",he loves to put students down and talks over your comments. it seems like he thinks  he knows everything about everything. if you can take someone else DO IT!,"Very passionate about film. This class was fun if you like to talk about different movies an appreciate cinematic techniques, but also if you just like to watch movies and learn cool things about them",Fun Teacher... Very few assignments but they are not graded very easily...,"Class is worthless/easy. Don't expect to learn anything interesting. Haven't had to write very much, so good in that aspect. Class is like listening to him beat a dead horse. He pushes the subject without really making a point. Thankfully its not very much work.",awesome dude,He never makes a point and still hasn't put our grades up from last fall semester when spring semester starts in 4 days!,His never actually makes his point,Easy/boring class...paper topics are vague. dont recommend
1692951,4.0,Jean-Pierre,Leburton,1,0.44427806261428404,"340 is SUPER hard. Prof. Leburton's office hours were really useful, though, and he very clearly cares about the class. He uses great metaphors and analogies in lecture that if you miss you're absolutely screwed. SO GO TO CLASS."
1976032,5.0,Michelle,Leckey ,1,0.5760003087758072,She has a cool accent
2287475,5.0,Jessica,LeCrone,1,0.27667898865614365,"Tons of assignments for this reference class, but I think I'm learning a lot. Unfortunately lots of projects, papers, and little assignments, and it can be hard to keep track at times, but if you are actually interested in reference you can't get much better than this. Not for the extremely shy."
2141708,5.0,Stretch,Ledford,1,0.5978739299611949,"After taking his class, I have learned a lot about how to make videos, take pictures and learn how to use photoshop and adobe premiere. Even though he has very high standards and the workload of the class is not light, he is my favorite journalism professor in UIUC."
889780,3.0,Andrew,Ledoan,3,0.16200469996732378,"Worst Probability class. I have taken Advanced Stat and Econmtrics (As). I got 60 on the final in this class and the average was 65. The tests were way too long, most people still there at the end. They were nearly impossible to finish unless you rushed. I have never had a past problem.  Homeworks very long and didn't count for much. Irritating.",the material is hard but he tries to explain it so everyone gets it. he tries to go over every homework problem. he grades the tests easier than other TAs.,"Unfortunately, he's too smart for his own good.  When he's drawing up step 2 on the board, he's on step 8 in his head.  Easy material becomes complicated cause of it, and he gets flustered trying to explain it.  It's simple enough material, he just complicates it. Just don't feel stupid asking questions and demand clarity."
618454,5.0,Joseph,Ledoux,3,0.6639698125364193,No Comments,"Just had him for summer session II. Best teacher ever!! He works hard to help you. Don't miss class though. Very fun and smart and he makes even technical writing class interesting. Very cute, but too big an ego sometimes.","He's a great teacher!  He understands what's important and teaches/grades accordingly.  Very approachable, knowledgeable, and passionate."
134133,2.2,Ki,Lee,2,0.4506685631339531,"Prof. Lee stresses, at least once per lecture, that he wants to emphasize physical concepts. However, homework often involves deep vector calculus work. Exams are HEAVILY homework and definition based, although he leaves the difficult math out. Study the homework problems and memorize all definitions, including all equations he says are important.","Lee seems to have no interest in flight mechanics, only the mathematics behind it.  Although he uses the word ""physics"" alot, it seems he doesn't want you to think about the physics, just the equations.  There is no need to study the actual subject matter, just study the homeworks and equation sheet and you will do just fine."
916865,2.8,Yi Ching,Lee,2,0.3791085340862769,"Very straightforward material. The exams are fair in the content they cover, but questions can be very confusing. You'll probably spend an entire lecture having to listen to everyone complain that their answer should be correct, too. Attendance not necessary - match the book material with her lecture outlines and that's that. Very easy class.","Her slides are striaght from the book, so if you highlight  the book it is not too bad.  The bad part about that is, she flips through her slides so fast you don't have time to take it all in, let alone highlight.  When you ask her for help she either has to look it up in the book (I can do that!) and then she tries some **** way to explain it"
932392,N/A,Yi-Ching,Lee,0,0
971356,3.2,Merton,Lee,3,0.500056257655774,His class is definitely no pushover and attendance is pretty much mandatory if you want to do well on quizzes and have a relaxed time with the essays. Although I had a very difficult time obtaining my grades I believe this class was  worth it in the long run to help me succeed at UIUC owing to the analytical skills I have obtained during the class.,"No, he's not easy.  Not sure what the last guy is talking about.  It's a tough class and it's very analytical of the text, but the class will definitely help you understand how to critically examine literature.  He's also one of the most intelligent profs I've ever had.",This guy has no clue what he's doing and the class is the biggest waste of time ever. It is ridiculously easy to get an A as long as you show up to all of the classes.
1132385,1.0,Jin-Hee,Lee,1,0.1272701278781589,"Useless, and so annoying. Can't understand what she said. It's useless to come to her class because she will teach you nothing. Don't like her at all!!"
1234387,5.0,Jung-Jin,Lee,3,0.6519261899351062,"I have taken a class much like this and thought this class would be a breeze. It was pretty easy, especially with Prof. Lee. He gives hand outs which summarize everything in the book in a comprehensible manner. His English is also very good and he does a good job at making sure the class can follow along. I wish he taught every math class here.","Great lecturer with excellent board technique. Nice handouts with notes. Accent not a problem, as he teaches the math better than most native English speakers. Would certainly take another class with him.","Matrices did not seem like a something I would enjoy, but Prof. Lee proved me wrong. He is a great professor. Even the hard material was easier to comprehend with the way he taught it! If he teaches another class I will for sure take it!"
1249084,3.2,Sang,Lee,2,0.45800464489209425,"If you take AAS100, do not choose her to be your TA.",This class was a weekend trip to East St. Louis to do cleanup projects and stuff.  Great way to earn a credit.  Teacher was extremely nice and always so helpful.  I don't know how she stayed so cheery all weekend!
1251994,3.5,Chia-Fon,Lee,5,0.5524731122651902,"It was not an easy class, but he graded pretty easy. It was fairly easy to get a good grade as long as you showed up every class and paid attention to the lecture. Most of the students got B+, and A. The lab was very very interesting, and TAs were extremely helpful.","The course material wasn't easy, but he made it doable. Very clearer, and knowledgeable. Fair exams and he graded pretty easy. Lab was fun. Really good class if u want to know IC engine.","Course material was good, but teaching style leave a bit to be desired.  Not very engaged with students and difficult to understand, even when using a microphone.","Very knowledgable, fun professor!",HARD TO UNDERSTAND
1365219,3.2,Jean,Lee,8,0.422446672002043,"GRADES TOUGH, YOU MUST WORK HARD AND REDO PAPERS WHEN GIVEN THE OPTION TO FOR A BETTER GRADE  ASSIGNS A LOT OF READING - AT LEAST 20 PAGES A NIGHT   REQUIRES YOU TO PARTICIPATE IN CLASS- PARTICIPATION IS A BIG PART OF YOUR GRADE AND IF YOU DON'T PARTICIPATE SHE WILL CALL YOU OUT","If you're into gender and women's studies classes that are really hard to get an A in, this classteacher is the one for you. She assignes A LOT of reading as well. It's a hard class, but I could see how someone might like it.  I think it's very dependent on your interests.","I'm not a fan of Jean. It is the end of the semester and we have not gotten any grades back yet. Very slow to grade, comments are not helpful and extremely confusing. She is really nice during class though, but overall not worth it. Take a different TA if at all possible.","She constantly says ""FABULOUS!"" The class itself is so easy. You have one textbook. For each class you get assigned three poems to read, but you can get away with not reading them. There are a couple writing assignments but nothing horrible. A really easy grade with not a lot of effort. She only thinks she is correct.",JEAN IS *FABULOUS*! FABULOUS I TELL YOU!,Most of the time I have no idea what she's talking about because she's off on a separate tangent. Written comments on essays are indecipherable and rarely helpful. This was the class that made me regret not attempting the AP English test in high school. Avoid this professor if possible.,"She's very nice and very willing to help you out. Also, she is very interesting and is able to interpret boring rhetoric concepts with good examples. Generous on grade!","I loved Jean so much. She helps you understand how to write in an academic setting and the standards that you'll encounter when writing during college. We did do like four drafts for every paper which got tiring and the peer reviews were useless, but other than that she was fabulous."
1408083,5.0,John,Lee,1,0.7080448801173738,amazing coursee
1615850,5.0,Tim,Lee,3,0.8054334642411926,"Great teacher, laid back, very knowledgeable, always dismisses class earlier than normal! Did not buy the book and still did very well. just look over power pts and go to class","OMGGGGGGG SUPER SUPER AWESOME!!!!!!!!!!!! hes so good at grading papers, the best ever :D","very helpful, teaches well, fun and engaging, VERY CUTE!"
1657946,3.2,Bumsoo,Lee,5,0.26986737192903154,"I get A in this course BUT He is the worst professor ever that i've ever met in my grad life in UIUC. He dont even deserve ""rate my professor"" tags Not clear grading criteria, boring class, never answer question clearly. if you wanna get A, your overall score must be above 93. Worst professor ever in my life.",Pretty interesting stuff for the second half of class. He's not a hard grader so just make sure to get things in on time. Neither textbook is necessary to do well in the class.,"He's an easy grader, and was helpful during office hours. Thinks (and says) it's all your fault if you don't do well, even when his study guides were awful. Lectures can get boring sometimes. Group projects and exams took a big part of grades. I did learn a lot from the class, but it could have been designed differently. Overall not too bad.","Prof. Lee is very friendly and helpful. He always makes sure that all the students understand the material given after class. What he explains in the class are very useful for the exam, so take notes. His slides are very informative too.","Professor Lee is a very friendly and knowledgeable teacher. He may be unclear at times, but he is extremely approachable. With that being said, Professor Lee is open to helping students out. You should have a basic knowledge of statistics for the course.  All in all, this class isn't that bad if you come to lecture and pay attention."
1666818,1.5,Suzanne,Lee,1,0.1900915227545444,This was completely useless.  We only used the book to take tests.  She showed so many dull and pointless movies.  Might as well just watched videos and not have her.
1787489,4.3,Chul-Joo,Lee,3,0.537859568672665,"You should take the class.  Prof. is very nice and mention the materials that would be in the exam.  No textbook needs.  He posts PPT slides and during lecture he explains each properly.  If you attend the class everyday and show him you are participating, you will get letter grade bonus. (not sure how much.... but you will get some bonus)",Concept explication is a big focus of this course.,"Professor Lee is a very nice guy, he is very interested on the things he teach. The class itself is easy. There are total of three exam and a 5 page research paper. He give study guides before every exam, and goes all over it. All the answers are give in powerpoint slides. The final paper was easy as long as you follow the guide line he gave you."
1880233,2.4,Yu-Ching,Lee,4,0.30889642138947887,"She's kind of a disaster in terms of running a course. Usually doesn't do more than read off her slides, which are very detailed (and posted online) so attendance feels not optional. BUT exactly five lectures count for attendance credit, so if you miss one of them you lose 1% of your total grade. So show up, but don't bother paying attention.",Patient and helpful,The absolute worst professor I've ever had at U of I. She literally reads off the lecture slides and sometimes confuses herself with her own notes. Going to class is useless unless there's in in class assignment (counts for attendance). Always shows up late to class and her exam seating protocol is time consuming and pointless. AVOID AT ALL COSTS!,"horrible! JUST HORRIBLE. The worse instructor ever. Pretty much just read her slide without any further discussion. The assignment is so long and difficult as hell. I can assure you that you won't learn a damn thing from her class. If it is a mandatory course for you, then I feel so sorry for you. If it is not, then change your schedule!"
