1808943,3.8,Valerie,Hotchkiss,4,0.5857527806613204,"Really nice, easy to approach, and a very enjoyable course","While Dr. Hotchkiss was not as explicit in her assignment descriptions as many professors, I found the independence refreshing! The assignments felt much more like situations one might run across professionally, where there is no manual or hand-holding. Besides, she was always prompt with e-mails in the event a question did present itself.","she was amazing, the best professor I have had in this program. the other student who rated her makes a fair point about the assignments but I learned more in this class then I expected and it was actually enjoyable!","Very disorganized. Her lectures are good and she has a lot to offer, but her course materials and assignment descriptions fall short. There are no assignment descriptions aside from the title. It is difficult to discern what she wants out of assignments and what her grading criteria are. Be prepared to work your ass off for 2 credits."
471038,3.2,John,Hough,17,0.43450536026266917,"This class is very interesting but a lot of hard work. Do not slack off, he does not do the plus/minus grading scale, just solid A,B,C,D,F. Attendance gives bonus points and there is also a bonus long-term memory exam. Beware: Dr. Hough is very prone to tangents and is indecisive. Class was poorly organized, especially w/Open labs and clarity.","You really do have to have an epiphany about this stuff or this course is going to be unnecessarily difficult. Get real, work hard. I bombed the first 2 exams because I underestimated the work. By the end I was a pro and you will be too. Med/Nursing/OT/PT/Pharm school is tough and if you can't handle this class don't even bother applying.","The soon-to-retire Hough is an okay guy, but he can't for his own life stay germane to the topic and always goes on completely irrelevant tangents.  Easy to get an A with all the extra points. Syllabus is too verbose and is 50 pages.  Very disorganized fellow. The class is annoying and too much work but take it, it's easy to get a good grade.","Dr.Hough is a real funny guy. He tells random stories in class. Lecture is extra credit. He comes off as condescending, but he is just trying to get his students to learn the material. He also gives an extra credit long term memory exam. Most of the class gets A and B. Don't do nething stupid and end up as  the subject of one of his random stories",Dr Hough is hilarious..he tells these stories that really have no point to them and laughs at himself for a while after. Hes awesome and a great teacher! He really makes the material more clear..but you have to go to the lecture to really understand it. Hes a little intimidating but really knowledgable. OKAAY! Its a miracle! NO ITS NOT! haha,"This class was an absolute nightmare, lectures are extra points so make sure you attend but reading on your own is the only way to understand anything. Unless you want to spend your weekends, (at least 7+ hrs) in open lab, I'd suggest NOT taking this class because you WILL NOT DO WELL!!",Dr. Hough is a great teacher and tries to make his class very fair for students. His stories are hilarious and makes attending lectures fun. This class is highly recommended for any pre-professional students and with enough effort you can easily achieve an A.,"Dr. Hough is a nice guy but a terrible teacher!  He is never clear and the notes are worse, but he gives you the old exams.  Study from those and go to open lab and you'll be fine.  Lecture attendance is extra credit, so go sign in and do a soduku or have someone sign you in.",Dr. Hough is extrememely knowledgeable and the lecture notes that he provides are straight to the point. Going to lab and open labs are a must. Dont think that you can get away with studying everything out of the Atlas alone.,He knows what he's talking about. Read the lecture notes before going to class so that going to class is a review. People who say that he can't teach go in expecting to be taught- Dr. Hough's lectures are meant to clarify and reiterate things from the book. The lecture notes themselves are well written and explain the material well.,"Hough is a great teacher. Go to open lab and you will be fine. Lecture exams are all true false questions so technically nobody should get below a 50%. You can usually do decent by studying some, but for the lab practicals, you must go to lab and study the terms.","I dont recommend this class for Gen Ed, pick something easier.  But if its a requirement then prepare yourself.  Dont fall behind on the stuff cuz its harder to catch up.  Dr. Hough is HILARIOUS.... okay...... (u'll get it when u c him)  lol   anywho... try 2 go 2 class and try 2 sit in front so u wont fall asleep.","DR. Hough is a genius and knows everything about human anatomy.  The class is difficult but if you can memorize a lot of stuff, you will easily get an A.  Most people get an A in the class.  I think you have to be a moron to get a C.  Dr. Hough is also very sarcastic and can be funny at times.  The key is to go to lab. Highly recommend the class.",He's kinda crazy.  I think he does have good knowledge of anatomy but he doesn't know how to teach very well or clearly.  You definently need to study and keep up with the material but if you go to class (you get extra credit) it's not terribly hard to get an A (about 40% get A's),"IT is a hard class, but their are plenty of opportunties for extra points here and there. Professor is kinda funny. Go to class, you get extra points. This course requires you to study ALOT.","I don't care about fish and animals, this is a HUMAN anatomy class!","Although Dr. Hough knows what he's talking about, he doesn't know how to teach any of his material. Unless you can manage advanced biology material in a class with horrible instruction, don't even think about taking this class."
122805,2.3,Colleen,Houlihan,11,0.33671250018604887,"In all my time being a student, I have not experienced a more arrogant, useless, and evil instructor as I did when I was in Colleen Schultz/Houlihan's class. It is a shame people like her are given a salary to teach. I want a refund.",Not as bad as everyone else is making it out to be. If you attend lecture an A is definately attainable.,Worst teacher in the school,"You take the test and know you got everything right, ""aced it!"" Unfortunately you get the test back and realize you got a C.  I wouldn't mind a professor that cannot take care of their health as long as the that person can teach well.",She sucks,"all around unpleasant experience - the only thing that made it bearable was colleen's uncanny likeness to the saturday night live character ""pat.""",Went to fast,"Tricky... Everytime I took an exam, I'd come out thinking I did well. But when I got the exams back, they wouldn't be that great.",scary woman,No Comments,very straightforward
1696798,4.4,Barry,Houser,11,0.715197786602038,"The best teacher I could have ever had in all my five years of being in this band. Really, truly cares about everyone individually. Knows his stuff with teaching and everything there could be to know about running a world-renowned marching band. Has an opinion and stands by it, but listens to others intently and humbly. Made me a better person.","It has been an amazing privilege to play under Professor Houser as a member in the Marching Illini! He has made my time at Illinois really special, and everyone who plays an instrument at Illinois should have the chance to study under him!","This is one of the best people I have ever had to meet in my life. If you have any opportunity to meet him in any situation, do so. His positivity and passion for life is contagious. I am so honored to have him as the director of the Marching Illini as well as a great professor at Illinois. ILL",FANTASTIC TEACHER! BEST PROFESSOR YOU WILL EVER HAVE!,"Great guy. Sometimes things can be hectic, but it's because he has so much going on along with Marching Illini. His positive attitude is contagious.","I've had Prof. Houser for multiple classes/ensembles. I can say that he is without a doubt he is one of my most influential teachers. He is so supportive of his students and helpful. Yes, he is not afraid of calling people out if they aren't meeting his standards, but he has greatly improved the quality of the Marching Illini","He's definitely enthusiastic and works hard for the band; however, the group's musicianship has suffered as well as the quality of drill. The band is becoming more commercialized, as it probably needs to, but the shows performed are not at the same calibre they once were. I hope that as he continues to learn that quality will again be prioritized.","Great guy. Upbeat and easy going most of the time. He can get pretty serious and angry every once in a while, but its usually deserved.","Overall great guy. He always will make time for you if you want to talk. He is doing wonders for the Marching Illini &amp; the music program.  He wants to make the band more involved and become much better than it currently is. At times he might seem a little intense, but that is because people don't understand how great he truly wants the band to be.","Does work well with the Marching Illini, and has brought us into the future.  His major flaw is that he doesn't use logic very well. He makes illogical decisions.  Also, does not keep his word, and will go back on it.",Professor Houser is a fantastic leader of the Marching Illini. I know that the MI wil only become better in the years to come.
1861179,N/A,Brant,Houston,0,0
1378832,1.0,Naira,Hovakimyan,1,0.27866974074222484,"just goes through her notes without explaining and assumes you know it all. She is really just trying to sell her L1 adaptive control concept so if you need adaptive control, take the ece one since this one is a waste of time. She also loves to emphasize that she had a phd from math"
1220550,3.3,Leanee,Howe,3,0.6086531868419779,She might seem a little intimidating at first but she's actually really friendly and will answer any questions at all about the class.,"She is nice and friendly outside of teaching.  However, she gets quite biased and accusatory against whites/european-americans during class.  Does not follow syllabus closely.  You can skim most books and be ok.  Her novel is great, much better than I expected.  Lots of group work and class discussion in this class","she keeps her lectures interesting and full of meaning.  she is a very sweet lady and is always open to hear students' opinions but always expresses her own.  the class is not what I had expected.  I was expecting another history class, however, this class is an insightful journey through the creation story of America and Indian literature."
1090061,4.6,Kenneth,Howell,8,0.6739896790978842,"class can def be boring but prof howell is really interesting, funny, seems to be an expert on everything. MAKE SURE to go to office hrs, esp if u dont participate a lot, he will get to know u &amp; itll help ur grade. fair &amp; approachable (&amp; i disagreed with him on everything). paints catholics w/ broad strokes tho, very conservative. dont do reading","Catholic or not, this course superbly teaches about the Catholic Church and her ways. Dr.Howell is the best professor I have had in college. A true Renaissance man and teacher. Difficult topics are discussed near the end and some have a hard time swallowing facts due to their emotions. Best class to expand your way of thinking altogether. Brilliant","As a Catholic and a bleeding heart liberal, this class was often difficult to bear. Be prepared to hear attacks on homosexuality, contraception, evidence for climate change and overpopulation. Dr. Howell is very intelligent, and a great theologian, but his political views are hard to swallow. He's always kind though.",Amazing,He works hard to explain difficult concepts in class and was always willing to meet during office hours to help. The best part though is that he is a really interesting guy and makes going to class an enjoyable experience. The exams and paper were challenging but it will make you a better student and challenge your beliefs in more ways then one.,Exams should not detract you from taking this amazing class!!! The professor is amazing. Do as much reading as you can.,"Wow. What an amazing class! The exams are pretty difficult, but they should not detract you from taking the experience of being in this awesome class. Read as much as you can and you will be fine.","Great professor and very interesting class.  His tests are multiple choice (which are tricky), and short answer.  The tests aren't a breeze, but you should be able to do decent if you study.  I would absolutely recommend this teacher and class."
810029,2.5,Michael,Howie,2,0.25003398284930156,"I had failed this class the semester prior with a different professor.  When I got Mike (DON'T call him Prof, because he will correct you every time.  He prefers Mike or Mr. Howie.), I didn't have much hope.  However, he helped me so much, was willing to talk to me and listened.  Great advice, amazing patience, and incredibly easy to get a hold of.",The. Worst. Professor. EVER.
487595,3.6,Fred,Hoxie,24,0.580514018227446,"Professor Hoxie was by far one of the best professors I've ever had. I struggled at first and blamed him for it, but I finally broke the 5-paragraph style essay and learned how to write a REAL academic paper. Discussion could be intimidating and difficult, but I truly learned so much. I'm sad he's retiring.",One of the very best professors at U of I. Class is almost entirely discussion based. He really pushes students to analyze themes and topics. I got more out of this class than any other history class. Take his class!,Best professor I have had at U of I.  Very interested in student opinions.  Takes time to help students with papers.  Thorough explanations on assignments.  Assigns reading but reasonable amounts and the texts are usually interesting.,"The class was pretty open-ended. Attendance is mandatory. Assignments are pretty easy and scarce. The exams are open-ended questions that don't have much to do with the textbook (general knowledge will suffice). Much easier than other history course options, but may not be the best gen-ed option. Quizzes are very point-specific to the textbook.","Quizzes in discussion section extremely specific to textbook.  Tests not relevant to anything in the textbook; not fact-based whatsoever.  Make sure you like to think creatively/analytically.  Clicker questions for attendance points.  Try your best to listen in class, not extremely interesting though.","HORRIBLE professor. If you do not have the same opinion or manner of thinking as him, you are wrong. Extremely opinoinated and biased. I thought that this class would be easy, but after a lot of work I feel like I've learned absolutely nothing and wasted time.","Interesting lectures, fair grader. You MUST read the book and go to class.","This class is really interesting and covers all aspects of U.S. History. Not difficult to get an A, just go to lectures and he'll point out what you need to know. Do the readings.","Very clear, and has great knowledge of the subject. Very friendly, one of my favorite classes.","I really like his lectures. A little hard to follow sometimes in lecture when he gives out outlines but, for the most part it's a fantastic class. Really like-able guy that you could definitely go to for help.",Professor Hoxie's class is one of the best classes that I've taken at U of I.  He does a really good job of being pretty apolitical.  I would recommend any class taught by him.,VERY opinionated and those who don't share his opinion will be singled out. Very confusing and hard to grasp what it is he wants or expects. Quizzes were VERY HARD and they counted a lot toward the grade. Don't wear a Chief shirt or that will get you into trouble too! Just very unlcear.,foremost authority on his subject...outstanding,"Hoxie is a giant in the field of Native American history, and his class is a great opportunity to learn about Native nations and hear their own stories, as he relies on many original sources by 20th c. Native thinkers.  Hoxie asks a lot of questions and wants you to think for yourself.  Very approachable and kind, interested in students' learning.","He's alright, nothing great though.  Don't talk during his lectures, he'll kick people out of class, even in Foellinger.",Hoxie is one of the most distinguished professors and he is great at what he does.  very interesting class and wish he taught more.,hated this class and his lectures,"hox knows his history. but often lectures were hard to follow, jumped around. instead of straight notes he uses pictures and paintings to supplement his lectures, i enjoyed this. exams were frustrating b/c you studied lots for only very short exam, but i didnt find them difficult.","His lectures were very interesting, and enjoyable, however, he does have a strong opinion and tends to have a lot of bias on many subjects. If you like to write then this is a great class to take. Overall, it was a satisfying class.",Very boring class. It's easy to get lost because it's hard to hear him all the time and he jumps around. Not very organized. Need to study 100 terms for the test but only know five. Main test questions are on lectures. A LOT of reading and A LOT of writing.
1485682,2.2,Mirth,Hoyt,7,0.23853713118014408,"She is a good professor, the class isn't that hard if you just put a ton of info in the lab reports. The tests are difficult though","As mentioned, your grade is likely determined by whether your TA is a hard grader or not. She's a relatively clear lecturer in terms of communicating subject content, but she doesn't stress the priority level of the content enough. Useless information aside, she's pretty hot I can't believe she doesn't have the chili pepper icon...",Really tough class.  The labs are such a pain to write and take very long to complete.  Getting a good grade in 233 is like chance due to who your lab TA is and the exams given.  Mirth is so hot though.,"Hoyt is a poor excuse for a Professor.  Bad lecturer (reads verbatim from lecture slides), takes a condescending tone, and just overall sucks.  In addition, she prepares zero to give out her poorly written exams to students.  She didn't even print out enough exams for the final so we all had to sit around waiting for an hour. DO NOT TAKE HER!","WORST PROFESSOR EVER. She talks to everyone like they are 5 years old, goes through slides way too quick, and expects too much for 2 credit hr course. TAs are useless. Didn't print enough exams for all students on final, so left for an hr while everyone cheated that got the exam at check in, then never came back. Good luck, you'll need lots of it.",Awful teacher. She is extremely rude and does no explain anything. She also expects you to know everything and talks down to you when you don't. Talks to everyone as if she was talking to mentally challenged people or 2 year olds. I end up leaving lecture early every time because she is so annoying an an awful teacher.,Totally don't understand what she's talking about.  Thankfully the TA is soooo helpful
1548376,5.0,Nicholas,Hryhorczuk,4,0.6082219447511197,Mr. Nick is extremely helpful. Easiest class I've taken so far in college. For RST 150 you don't need to read the book he tells you exactly what you need to know on the lecture slides. He doesn't post them online so you should team up with someone in the class or I guess he would probably just give them to you. Has text review/tests in class.,He's super nice and know a lot about tourism. Easy A!,"Taking 150 with Nick was awesome. He's traveled all over the world, and he has the best stories. I actually looked forward to going to class! Also... He's hot. WAY hot.","Great teacher, very helpful, he makes class fun! Also.... crazy hot. could it get any better?! Take a class with him if at all possible!"
934048,3.2,Elizabeth,Hsiao-Wecksler,6,0.43407124579753864,"She fully and completely understands the material but is NOT the best at the ""teach you like you're five"" approach that the top professors have. Not bad, but not great, and the class as whole has a system that's very difficult to get used to.","Great Professor! She does care about the students, which can't be said for all professors. The lectures  and tests are pretty straight forward. Can be tough at times during design reviews but she's just challenging you to make a better design. If you like to design and build than you'll like this class. I would recommend her as an advisor as well.",Not helpful and does not give credit unless you do it the way she wants.,I was told she was good and taught well but I think something has changed. Her lectures are not too helpful when asking her questions. She has in-class assignments but you can figure out when because she posts them on her lectures so you just have to look ahead of time. Homework started easy but got harder and is not really covered on the tests.,"One of the better professors Ive had. For most of the course she explained the material pretty well, but at the end she seemed to burn out. Exams were easy and focused on the basics of the material. The course was mainly centered around the two design projects and she discussed them a lot in class which was helpful.","She did a decent job teaching the class.  Lectures were pretty good.  Tests were extremely easy,  which was fine but also means no curve.  I think ME 370 was one of those classes that nobody really hates, but nobody really likes it either.  Just do the homeworks and don't fall too far behind."
1227482,4.0,Kuang-Chien,Hsieh,2,0.5150124879675997,"Prof. Hsieh is a pretty good professor. He knows clearly about the material. But ECE440 is just too hard, and he tries to cover more than what we need sometimes. In terms of preparing for the exams, the TA can help more. But overall he is pretty good, at least better than other ECE440 lecturers.","Professor Hsieh is possibly one of the greatest professors I've had in ECE.  He makes the ece440 material easy to understand, its very caring to students, and cares more about the student than the grade.  I wish he taught more classes! Go to his lectures, they help, and if not, go to his office hours, even better"
182098,2.5,Feng Sheng,Hu,19,0.3312884865443688,Dr. Hu is an excellent teacher who has high but reasonable standards.  You probably won't like his class if you are not motivated to learn.  His lectures are all extremely informative and well-organized.  He does NOT have a thick accent at all.  In fact I was impressed by his flawless English.,"Ok let's get some things straight. Dr. Hu is a great professor, is incredibly intelligent, is NOT hard to understand, and the class does teach EXCELLENT information in the topic of Ecosystem Ecology. This class was great, not too difficult, and I learned a lot. Never read the text book but will keep it for a resource.",I would have to disagree with previous comments. I took his course this past fall and found the course very interesting and engaging. His accent is not very thick at all. I even have bad hearing and there was never a point when I did not understand him. He is also one of my advisors and I have found him nothing other than approachable.,"He is hard to understand most of the time, but his random pronounciations make it more entertaining. The class is kind of all over the place, with no real connection between materials.","He is very knowledgeable on the subject, but has the proficiency of a 1st grader in speaking English.  Luckily the material is very easy and an A+ is almost guaranteed with the curve.","It wasn't a horribly difficult class, but lectures were pretty boring and I found myself just relocating to sleep.  He has a pretty thick accent, but was fairly understandable.  His tests were fair if you read the book and reviewed your notes.  85-100 was an A so I wasn't complaining.  Class is pretty excruciating but not difficult to do well in.",very hard to understand! the exams are farily easy... he is willing to help. He tries to crack some jokes but that does not turn out too well because you cant understand what he is saying.,"I think he is a pretty good Prof, but he goes WAY in depth about paticular subjects and makes it really boring. I found it hard to know what to study for his exam. His exam is pretty fair and straightforward. Of course, there is his infamous accent, it could get annoying!","So damn hard to understand, no personality whatsoever","extremely difficult to understand, and extremely boring",i'm usually super bored during lectures-and i'm a bio major! material is not introductory as it should be-puts way too many charts and graphs it is overwhelming. covers obscure details instead of big picture ideas which the course should be seeing as it is a 100 level course,Class was fun and material was explained in great detail. great class.,"Quite possibly the worst professor to teach an undergrad course ever.  Even if you manage to stay awake through the incredibly boring material, good luck understanding him at all.","oh...my...God...can this man be any more boring and difficult to understand? One of the worst profs I have ever had, and I've had many",can't understand him at all. hard exams that don't really pertain to lecture. very boring class in general.,"He's very difficult to understand and his material puts us all to sleep:( Seriously, could you possibly make ecology ANY more boring?","I could never understand anything he said.  The material was soooo boring, and the way he presented it all didn't help at all.","Verbally he's hard to understand, and sometimes he's an ass...he loves flipping slides just to make note taking difficult.",Sometimes hard to understand
