1157103,1.7,Bryan,Heidorn,3,0.4191475053529983,"Poor communication, sloppy notes, technologically lacking, ceated confusion between students (tells one this, the other that), time mis-management, fair grader.","Now teaching at University of Arizona. Director of School of Information Resources and Library Science.  Unorganized, Administration is more important than students, last semesters' syllabus and with unchanged dates.",No Comments
1121360,3.4,Stephan,Heilen,7,0.4522322328773206,"He's a good teacher, but sometimes very tired. He ever helps his students.",This professor is awesome! If you go to class you will learn everything you need to know for the test. I never did a single reading for the class and came out with an A. The papers required minimal effort and only limited quotation from the readings.,This class is incredibly easy!  Yes there are a LOT of readings but Heilen goes over pretty much everything important from them in lecture.  Even if you don't go to class it is easy to get an A...he puts all his powerpoints on compass and goes over everything important the lecture before exams.  I definately would take another class with him.,"The hardest class I've ever taken! If you miss a lecture, there's no way of getting the information. In addition, it's a little difficult to understand his accent, especially with the complicated Roman names. Exams cover everything including readings (which are a whole lot). The professor himself is really great and nice, but the course is hard!","I came into this class with a relative interest in Roman history. The professor is extremely nice, and really takes the time out to help a student in need. As for the class, he teaches straight off of a typed sheet of notes, his tests are NOT easy, his paper criterian is demanding and toughly graded, and you really cannot afford to miss lecture.","Not a fun class. He reads from his lecture notes, hard to understand, refuses to post his notes online, and his tests are difficult. His papers are demanding, and the purchase of 5+ books is required, yet you rarely use any of them. VERY nice professor, but this class blows.","So boring! During lecture, as he goes over the slides, he reads off a typed up lecture. Basically, the lecture is like someone reading to you for an hour. Go to class and read the books."
395707,4.3,William,Heiles,10,0.4820428053641014,love him,"He is actually pretty strict cause he always have really high expectation for you, but he will never push you to do it, so you gotta force yourself to try to reach his high standard.",He is the best guy i have ever seen and also one of the best teach i have ever met. He encourages me a lot.,"he is too easy, too nice.","He's super punctual, and I suppose, strict. Got to push yourself, he's too nice. He will NEVER tell you you need to do better...he'll show it in other ways.","Very punctual, and he always devotes all his time to students. He tries his best to give a lesson every week, and is really helpful. Might be strict, and you got to drive yourself. You definilty need self-discipline to get along with this guy",if u can't push urself don't take him he is too nice,"Professor Heiles guided me through much of my doctoral studies in piano, and I found him to be thoroughly professional, helpful, and knowledgeable. He was always punctual and he devoted his undivided attention to the student during lesson times.  He expected much from his students and is the kind of teacher whose standards I wanted to meet.","I was the only undergrad taking Harpsichord from him and he treated me like I wasted his time.  Very little feedback, didn't return calls.  I don't think he enjoyed teaching very much.",No Comments
1083660,1.9,Adriana,Helbig,6,0.28346326081764245,"The biggest mistake she makes is that she thinks we are actually interested in the material.  Slides are posted on Compass, so there's really no need to go to lecture much.  Quizzes are harder than the tests (free answer vs. multiple choice), and know the listening examples.",I HATED this class. it sucks. really hard and confusing. all that counts is the hard  tests and participation in section :( Does not use book at all! But says you should spend over a hundred dollars on the new version of it!,"Disappointing class--Helbig clearly knows her stuff, and would probably be more interesting in a smaller class, but in a big lecture hall it's lost in translation.  EXTREMELY difficult to keep different cultures/musics separate.  Should be worth more than 3 credits!","It's a difficult class if you are not familiarized with different cultures. It's just so hard to keep different things separate. I like the way she lecture, though the whole attendance deal stinks","Did NOT like her class. It was her first semester so hopefully it was just a rough start. Never posted grades on Compass because she said it was ""broken"". What was supposed to be a fun, easier class with Turino (who is AWESOME) turned into a nightmarish bore.","What good is there to say about this class?  She teaches this class like we actually care about the material.  This used to be a blow off class, but not anymore.  You have been warned."
184690,2.7,Bill,Helferich,3,0.5431651743407553,"It's a good class that if you do the work, you should get an A.  The tests are short answer and multiple choice, but if you read the notes the answers are right from there.  The teacher wants you to do well.",No Comments,"This nervous little man has his T.A. write a killer, short answer exam that expects you to know every last topic to the finest grain of detail."
1198735,4.0,William,Helferich,1,0.42228732671142827,No Comments
927951,4.3,Steve,Helle,24,0.6128463165823494,"As Helle's graduate assistant, I was asked to transcribe all his class lectures from a recording. I was irked at the start, but really learned a lot typing and compiling them for future use. It was a very productive project for me and I learned almost as much as if I'd taken the class, which sounded like terrific fun.","Love this man. Pretty sure the only class he teaches now is in CHP. If you're in CHP and reading this, take the class! It was my favorite class ever, and might have somehow convinced me to go to law school.","The readings could be complex, but he was great at making lectures interesting so I felt that when I left, I had a good grasp on the concept. Grades came from participation and oral debates.","Steve is a great professor. He is very knowledgable on all the subjects we talked about, and they were very interesting. We just had 2 in class debates, an original speech at the end, participation, and a scavenger hunt as part of our grade. He's a very fair grader and it'll be an easy A if you put in the work.","I wasn't looking forward to this class because I had no interest in law, but Helle is so enthusiastic about it that he made the subject fun. Fantastic lecturer, I wish more professors were like him. Exams are challenging, but if you come to almost every class, pay attention and take good notes to study from, it will be okay.",Prof. Helle is a fantastic professor who is passionate and knowledgeable about subject matter. He is everything a college professor should be. Please ignore the imbecile below with a negative post about Prof. Helle.,"A really interesting class that really made me think. Professor Helle was excellent, and with a little bit of effort and decent research, this class is nothing to fear because Helle will help you out if you need it.",Keeps students interested and is really good at explaining the material.,"Helle is a great lecturer, pretty engaging. Topics discussed were pretty interesting. He will call on people at random, so readings aren't optional. Tough but fair grader, he met with people who didn't agree with their grades and allowed them to discuss them. With decent research and speaking abilities, you'll be fine.",has no sympathy. I would not take this class because he made it stressful and puts pressure on you. strongly disliked everything about this class. very negative experience.,"Great Professor. Very hard class, but he is very clear and engaging. He makes it a point to remember your name and will use that to call on you. Very fair grader, but tests are extremely difficult.",Helle's class was pretty hard...there were only 2 exams (1 more is optional) and a small amount of participation. He randomly calls on the students so everyone is engaged. He is a great lecturer and is enthusiastic but the material is challenging. When meeting with him he was also a little rude. The exams are also curved big time.,"This was the college class I feared coming in which I would do my best, try my hardest and still fail. I found it impossible to get higher that 40% on our papers even one's that were 200-500 words longer than the minimum and featured citations from 7 sources and 5 court cases. I really hope the required 411 is much harder otherwise I'm screwed.","Enthusiastic speaker who does a good job keeping the class engaged. He'll randomly call on students to participate so be alert unless you wanna look foolish :D. As others have said, his tests are hard but fair. He expects a lot from students but is willing to answer questions. Definitely not a class you can slack off in.","Greatest professor within journalism.  He's a hard, fair grader.  Study for exams, know your stuff, and he'll reward you.  Don't take his class for a grade; take it to learn.  You'll look forward to going to class.  He's not only a teacher but a performer.",Great teacher. Hard but fair grader as others have said. Always willing to help. No study guides and very hard tests. The first two test are written and the final is a cumulative multiple choice. Make sure you asks questions because he will always explain what he means or clarify what a law means. Very interesting class if you are considering law.,"The class is difficult-there are only 3 exams, an essay, and a hint of participation points. That being said- he is a great teacher. I learned an incredible amount from him, and he takes a great interest in his students. If you have test trouble- talk to him- I needed to. He will help you.","Helle is an interesting character. He's very energetic and bouncy and the subject material in the class is interesting enough. The entire grade is based on you exam grades, so you gotta know your stuff. Also, he picks random people in class to answer questions, so if you don't like participating, you're just going to have to deal with it. Have fun.","Professor Helle is a brilliant man who clearly knows his material well and easily brings his understanding to his students.  Great sense of humor, grades TOUGH but fairly, and was fun to listen to.  Def. Recommend him.","Helle's class is definitely not easy, but it's manageable. Your final grade is based entirely on how you score on 3 exams, so prepare to study your ass off and he can be nit-picky with his grading. You get a scenario, and you have to analyze the legality of it.. strictly essay exams. Helle has a great sense of humor which makes class more bearable."
908673,1.0,Wendy,Heller,1,0.42228732671142827,No Comments
2097330,4.0,Jeremiah,Heller,7,0.4588903168715614,Lecture is very clear and he gives pretty generous curve &amp; grading.,Really does a great job. Not hard at all. In fact very easy compared to most upper division math classes at UIUC.,This class is easier than I thought. The materials are really not hard at all and the exams are not hard. Proofs in this lecture are very clear. The final is easier than midterms. Professor is very nice.,"Great professor! He rites all his proofs on the board and explains them well. If any concepts are unclear, he's more than available to speak outside of class. Tests are very reasonable; he tells you exactly what you'll be tested on and it's all lecture material if you copy what he puts on the board. Would definitely take another class with him.","New professor to teach MATH347. He prove a lot of things in class only by writing them on blackboard, and most of the time I cannot understand things. Reading book helps a lot. Exams are not doable. In general, never choose a prof whose name contains hell. Very tough. And just little curve.",He is the new professor for 347 and his lecture is terrible. He proves a lot of stuff in his class and the proving process is unclear. He does not clarify the main point of each lesson. His final is a disaster. The whole class is a mess.,"New professor at U of I, class as a whole is moderatly difficult. It is recommended to read the book aswell as it does help. Chegg saved my life in this class as nearly no feedback is given, and online answers are great for studying.  Lectures were kind of boring, but he taught what was needed."
2134505,2.9,Martin,Hellwig,19,0.33302639240660775,Probably one of the more difficult classes I've taken.  Class isn't mandatory but it would help a little to go. Definitely get help from the TAs because they can clear things up for you.,"There is no textbook for this class. His slides are always online, but they are only helpful if you were in class. If you miss class, you have to go to office hours to catch up. There is a lot of live coding. It's very different from my other classes, but once you get the hang of it, it's actually fun. Dr. Hellwig and the TAs are really helpful","Honestly he isn't that great of a professor, but the content is easy enough that you can get an A without really going to his lectures. Just learn the stuff and you will pass. I only needed a 42 on the final to get an A in the class, so just try and ace everything excluding the tests because its easy to do that.","The subject material isn't THAT difficult, he is just terrible at teaching it. All the lecture slides are posted online, but he spends the majority of class live coding and there is no where to refer back to what he does it class. He does so fast and it is extremely difficult to keep up. I found the labs and the TAs to be extremely helpful though.",So I just took my Excel exam yesterday. Was very scared and stoped by Dr. Hellwig's office before. He spent an entire hour helping me. That was so helpful!,"Really cool guy. Hard class for sure (like five hours of homework hard), but he's really helpful.","The machine problems are really hard, but Prof. Hellwig is super nice. There's extra credit on the final project. Don't miss a class though. Things move fast.",This professor sometimes speaks too fast and thus it will be a little hard to get his points. But he is pretty creative and TA truly helps.,No extra credit. Super hard machine problems. What he taught in class was neither the content of the machine problems nor the content of the exams,So I was pretty confused in this class at first. He throws a lot of new stuff at you in a really short time. But before the midterm he sent out some really helpful emails and he also allowed a cheatsheet.,This has got to be the first professor I ever met who will sit down with you and explain the same thing fifty times until you finally get it without making you feel stupid.,"Professor Hellwig is not a good teacher, like he is legit awful.  During lecture he does live coding without explaining anything, leaving you lost and confused.  Avoid this course if you can.",I'm an Economics major and this class is pretty difficult for me. I spend several hours in lab every week. Class moves pretty fast and missing just one hurts pretty bad. But the assistants are really helpful. And Dr. Hellwig is really nice too. Best thing is the live question thing where we can send questions to the big screen.,"His class is super hard, but he does a good job of explaining things. I wish the room was smaller - seeing the screen is pretty difficult from all the way back. Office hours are very helpful, but there are not enough TAs for 700 students! Best time to see him is after class - he always stays an hour late.","He does not teach at all. He does the code on the projector screen, but he doesn't describe what he is doing. You basically have to teach yourself the entire code by asking a million questions in your lab and going to many office hour sessions with the TA's","He is not a good teacher at all. We have four mid-terms each semester and he tested us a lot of things he never talked about. In class, I don't quite understand his logics. Anyway, I won't take his class any more.","I had this class with Wade and Martin. Compare to Wade, Martin didn't see to be really good at teaching. He tried his best to make things funny and attractive but they are just not. Make sure you sit really close to the stage or you will literally see nothing he is doing. The formulas are pretty self-explanatory.","An intro class at the 100 level should not be this hard, but somehow this professor makes it so. The class is disorganized, with MPs released a week after they are assigned and various class slides not being released at all. I'm pretty disappointed in how the class went this semester, as I was really looking forward to the subject material.","I don't like his class. He is not good at teaching at all, and the lectures are boring and confusing. CS 105 is the most overwhelming class I've taken in college. I feel like I learned nothing. And I will never take this class again."
1394427,4.9,Sandra,Henderson,4,0.5993894879270106,Wonderful person. Great teacher. Good class. Highly highly recommend her for all students.,"Best TA ever. So nice. If you show up to class and participate, she'll love you. Super helpful. Only wants you to do well.",Sandra Henderson was my ta for hist 172. She is ALWAYS willing to help which was nice. She knows history fairly well and is a big help before the exams. You have to earn your grade in her discussion class- she doesn't just give it to you. Wasn't a bad discussion class at all- pretty interesting at times. Nice ta,"BEST TA EVER!!!! She did everything possible to help you succeed and was VERY VERY HELPFUL. Plus shes really hot, 10/10 definitely. If you dont get this TA youre missing out"
1861195,N/A,William,Henderson,0,0
1495996,3.3,Jarrod,Henderson,7,0.557106309721086,Best teacher ever!!! Everyone will love him!!!,good professor- class is hard,Attendance is not really mandatory. He does randomly call on students to answer questions.,Teaches directly from the book. Attendance is optional if you read. It was his first time teaching the class so I'm sure his ability will improve. Overall a very nice guy.,"It is clear that Dr. Henderson is new to teaching ChBE 221.  His examples in class consist of simply working out the book example problems line for line as done in the textbook.  Often times, he struggles to answer questions that deviate from what can be found in the textbook's working of the examples.  Surely with more experience he will improve","Very calm and happy professor. Class is somewhat difficult but helped by willingness to help with any issues. Emails can be terse, but don't take it as him being upset, he just writes that way. Attendance is pseudo-mandatory, in that he checks occasionally and is factored into an overall ""participation"" factor of the grade.","hard as heck , but fair"
1088345,2.0,Christopher,Hendricksen,7,0.3363674604929069,"How I got a B+ in the class is a surprise to me. Why? He graded 1 essay out of the 7 or so he made us right, but it turns out the 1st essay wasn't even for a grade. We never got our final grades and I'm assuming he arbitrarily assigned grades to everyone. Extremely boring, put me to sleep everytime I attended class.","He explains the readings well in class (you can skip several readings if you just show up and listen to what he says about them). BUT he never graded ANY assignments until the semester was over, so your grade is a total surprise. Very frustrating, I couldn't believe the laziness. I still pulled off an A- but this class was not worth my time.","We have written 5 papers for this class which make up the majority of the grade. School is over now, and he has yet to grade any of them. He'll probably give us all A's, but it's pretty ridiculous. The class is extremely boring, as well.",No Comments.,"I had a very hard time paying attention in this class. He would often change his mind on what he was teaching based on what students would say. Very confusing. Seems like a nice guy though, just isn't very clear.",No Comments,"Boring, but an easy A if you attend class and do some of the readings."
1077029,4.6,Ryan,Hendrickson,16,0.6459321880825268,"The most organized professor I've had in the Political Science Department, while getting an A does take work, it's definitely not difficult. My favorite professor because of his amazing powerpoints (perfectly organized). Lectures are interesting, a few quizzes, two essays, midterm and final.",One of the best professors I've ever had. You will love this class and professor! Cannot recommend him enough!,"He is definitely into what he teaches and makes lecture super interesting. I loved going to class. Take good notes, pay attention, and keep up with the readings because he gives pop quizzes (which you can usually predict). The readings correlate well with lecture so it's easy to follow along. Take him!",Great professor. You can tell he really enjoys teaching and really knows his material so it makes the class much more interesting. The TA I had was great too so overall great class to take whether or not you're interested in PS. Not too bad to look at either.,What a beautiful man. Compelling subject matter. Favorite class this semester.,"Great professor. Interesting and cute. Wish I could take more of his classes. You  have to read because he gives pop quizzes. But the readings are from novels are really interesting. Take notes of reading and you will ace the papers and exams. Take really good notes in class as well, which is easy because he is interesting. Overall great class","There is a decent amount of reading you have to do because he does a few random reading quizzes throughout semester (which dates I find you can predict based off his schedule). All of the written assignments he grades pretty easy, as does he grade pretty easy with the quizzes and exams. The exams are just sometimes slightly too specific but doable.","There is a decent amount of reading that you can't blow off because he leaves open the possibility of a quiz every week. He is passionate about his field and pretty knowledgeable, so if you share his sentiments you will really enjoy the class. Otherwise, it isn't by any means an easy grade if you are looking for a blow off class.","I've had him for 3 classes and have enjoyed all of them.  He is very straightforward and very unbiased.  He doesn't ask a lot of you (do the readings, go to lecture and pay attention), so if you just do those things thoroughly you will do very well.","This prof is great! I have taken PS 280, PS 395, and now PS 390 with him.  He is definitely a great and interesting lecturer.  His tests aren't too bad and as long as you keep up with the reading, you will do fine on the pop quizzes.  There are also some written assignments that are not too bad.  I definitely recommend this prof!","I've had him for 280, 395 and now 390 he structures every class the same, 5 pop quizzes that are extremely easy if you did the readings and two exams that are fairly easy. He's a good teacher and his classes are pretty easy. I'd recommend him.",I have now had Hendrickson for two classes and he is interesting and knowledgable.,Clear cut class. Interested and interesting teacher. Made me love political science!!,"He is a good professor, really interesting and knowledgeable. Only bad part is he doesn't post power points online and his lectures are not pivotal for the exam, however he does random attendance checks and pop quizzes in discussion.",Very good Professor. Lectured very clearly and concisely; 50 min lecture didn't seem like it took that time. Doesn't teach his bias and is very fair; I'd take any of his classes.,"Hendrickson's teaching definitely made this class for me. Very knowledgeable, passionate, and interesting in lecture. Adds a personal touch that made me love international relations even more. On top of that he's very charming and a total babe. discussion is a pain because of pop quizzes, but overall a straightforward and very interesting class."
