1331075,4.8,Baron,Haber,2,0.7496175816021984,"Baron runs a good class. He is well prepared for discussions and keeps things interesting. He's also extremely nice and willing to look over writing--even if it is not for class. When I took it, we did free writes every day, and it helped my writing immensely. His grading can seem a bit harsh.",Awesome teacher that simply gets it. You won't regret taking a class with him. He's an amazing writer as well.
2232326,3.5,Michael,Haberman,4,0.605234677446815,Class is demanding but very fair;  you'll learn a lot if you never programmed before; definitely worth taking if you want to find out more about computers,"Arguably the best professor I've had thus far at UIUC. Knows his stuff, and is very engaging, kind, and cool. Very eager and able to help whenever a student needs it. He even made me want to switch from business into CS. Makes computer science fun, easy to learn, and though-provoking.","Prof. Haberman; definitely a nice guy, but his class is so frustrating. Only one lecture a week, which is an hour and a half but could be summed up in about 5 minutes. No textbook, hardly any resources except to hunt down your TA all the way across campus during their 1 hour a week office hour. Hardly any ways to seek effective help for class.","He knows what he's talking about, but he mumbles, almost never uses his mic in a lecture of 450 people, and doesn't really wait to make sure everyone's on the same page. Very hard to follow, but I've learned so far. People around you are loud, and you gotta make sure you're listening to him. He's still a good prof, but yeah."
274854,1.4,William,Haboush,44,0.25712377693279886,He is the type of professor that likes to teach the subject his way even if none of the students understand,I have really enjoyed having him as a professor. He is an incredibly interesting guy if you get to know him at all and he really cares about teaching the subject material. I couldn't recommend him more.,"I did not learn anything from lecture. I had to teach myself everything. The material increased in difficulty fast so this was hard but manageable. If you are coming into this class thinking it is going to be easy, you are wrong and have to be ready to put a lot of work in. Read the textbook and do the example problems in there to learn.","Consistently shows up to class 5 to 10 minutes late. Mutters, difficult to follow what he's doing on the board, and has barely legible handwriting. You'll have an easier time learning the material by teaching yourself out of the book and attending TA office hours.","On both of the mid terms, one of the forms will have a question that is either ""impossible to solve"" or just harder. So half the class gets unfair points. He also will say ""there won't be a question on this material on this exam"" and half of the exam's points will come from that material.  Talks to the board, isn't engaging. Wouldnt recommend.","He said that he wouldn't put a certain problem type on the midterm, but ended up putting it on anyways, telling us he would give us partial credit if we at least attempted it. I attempted &amp; lost all points, bringing me down from an A to a B. I just think that's pretty unfair. At least there is a curve. Not a big one though. sigh.","Poor preparation, poor lecture performance. Since there are pretty many lecturers for MATH 285, I really recommend that students pick up other's sections.","You have to teach yourself the material in this class. Prof. Haboush seems unprepared and disorganized during class, so the lecture isn't very engaging or helpful. The exams are difficult (most people didn't finish), but the results are curved, so the overall difficulty was tolerable for me.","I got a good grade in this class, but has to teach myself everything. He is embarrassingly unprepared. Doesn't proof read the tests until you're taking them, so he'll announce half way through that there is an issue. He makes many mistake in lecture. Try and take with anyone else.","This guys is probably one of the worst teachers I have ever had. He just talks into the board not explaining anything, and makes mistakes left and right. He is completely unorganized, never clarifies what will be on exams and doesn't respond to emails. He doesn't even take the time to provide practice exams. This guy does not deserve to teach","Just a horrible professor. Talks aimlessly during lecture, gets lost in his own work, and does proofs that don't matter for tests. His tests are graded very hard, and he'll take forever, if at all, to get them back. Take someone else!","Every time I go to the class, I see two kinds of people: one with question mark on their head, and the other with fingers scrolling on the screen of smartphones... even though I tried to understand his lectures, he screws everything up by writing LOTS of equations he fails to explain... IF YOU CAN'T AVOID HIM THEN DONT TAKE THE CLASS!!","This guy shows up consistently late to his own class, sometimes not even showing up at all.  His ""teaching"" method looks more like he is trying to prove that he knows a subject than actually explain it.  Does not prepare problems for lecture and usually screws up when making them up on the fly.","Just brutal. Fumbles around the entire lecture on the board, and manages somehow to neither teach the basics of diff eq nor give useful examples. Midterms were too lengthy and tedious. Avoid avoid avoid","This dude is a joke. There are 4 questions on the second midterm, and he found 6 mistakes while we were doing it. I rated interest to attending classes as 2 points simply because I am a person who like to see jokes","I came into this class quite familiar with Linear Algebra and walked out possibly worse off than I entered. Haboush is a brilliant man, however he could not teach even if his very life depended on it. I read the reviews on here before taking the class and just shrugged them off thinking ""can't be that bad..."" Let me just say.. I was very very wrong","This class just makes me laugh. Pretty much the worst case scenario here when it comes to a math teacher anywhere. Always does proofs, NEVER examples, and never makes anything relevant to the audience he's trying to teach. Grading system is bad, you compete with others for grades. Tests literally seem like they were written 5 minutes before class.","Worst math professor I've ever had. He taught as though the class already knew the material, he spent all his time on proofs that weren't on any exam, and he never seemed to have prepared anything before class: he was always wasting time making algebra mistakes. And on the final, he said that sigma wouldn't be zero, but it was: 1/0. Just great.","Haboush is obviously an intelligent guy, but not a good teacher by any means. Spends class time doing proofs that won't help you in the class. I still thought it wasn't hard to get a good grade considering the class before an exam he tells you exactly what kind of problems will be on it. I taught myself from the book and got an A in the class.","NO. If you are reading this, then you obviously care somewhat about your grades. Go out of your way to not take Haboush. By far the worst teacher I have ever had. Consider yourself warned."
752471,1.5,Carrie,Hacias,1,0.10122256873942954,"she was awful, i hated her and she didn't help, going to her pseudo-lecture BLEW"
1228793,2.2,Vicky,Hackbarth,9,0.3106501354499872,She's just annoying. She doesn't make directions clear and adds unnecessary busy work to activities. Always seems to do everything in the most backwards way possible. Half my class dropped within days because she was the teacher. Try to avoid.,"Okay, Sra. Hackbarth is a very nice person, however, in order for her to hear you out (in a grading situation), use the discussion board, meet her outside out of class, etc. Just keep up with the weekly quizzes and thoroughly read the the readings AND ASK QUESTIONS on them in order to perform well on the exams because they are a good % of grade.","This is more of a review for the class because we only have a few class sessions all semester. As long as you read the book and do the activities and home, it's an easy A. Prof. Hackbarth also sent emails to clarify where class was and what to expect, so nothing was every confusing. She seemed very nice in class.",There is seriously no class I have hated more than this one. Expectations were NEVER clear and class is done in an awkward hybrid online format. I hated everything about this class. Nothing about it was helpful to me in learning Spanish. It is literally one of the worst classes I have taken in my entire life and unfortunately it was required.,i HATE this class. she has completely unrealistic expectations for a class in which she doesn't even teach!,"She was a boring teacher, but the class was really easy, and I got an A+ without ever going to it. It was really basic and she didn't seem like a bad teacher to me...","Worst spanish class I have ever taken at the University. She is not a fair teacher at all, she picks favorites.",No Comments,"This is the worst class and worst instructor ever! She is so sarcastic and just plain rude! She does not care anything about her students. She needs to take a course in professionalism. This class is conducted directly from the book and just is awful, period. What a waste of time..."
1072444,3.5,Paul,Hackman,1,0.63835565889127,"Good teacher; clearly knows his stuff; grades papers somewhat fairly, though he seemed a little harsh; class participation is expected and graded, though class attendance is not mandatory I would recommend going because a lot of test material is from lecture"
2478822,N/A,Don,Hackmann,0,0
1244082,4.4,Pamela,Hadley,8,0.5152601126776253,"You cannot go wrong with taking this class! She honestly just wants you to learn and pass the class. There are two exams and a final with very detailed study guides for each. If you look at them, you'll surely pass. Then there are about four papers that aren't that long. Lectures are mostly interesting with a couple of videos.",What a sweet lady. Prof Hadley is very kind and obviously caring about what she teaches. Easy A if you attend lecture and do the simple assignments. Some online quizzes. In-class assignments but usually announced on syllabus and are very easy (she gives answers). Highly recommend--very interesting for anyone wanting kids someday.,Prof. Hadley really cares about her students and that shows in her teaching. She's really nice in person as well.,In all honesty I thought this class was boring and this is my major so I should have liked it more. But I did not,Awesome U of I gen ed. Not that rigorous (i personally only studied when an exam was the next day) and the teacher is very passionate and friendly.,Extremely nice professor. Very willing to help you. Exams aren't bad. Assignments are quite easy. Readings can get long but she explains most of it in class.,"I'm a psych major, took SHS120 as an elective out of interest,I was really impressed with Dr. Hadley's lecture style. She's SO nice, engaging, and really cares that her students understand the material and do well.Online readings and the book (not a textbook) can be a bit lengthy. Tests aren't difficult if you study moderately. interesting class!","Definately need to study for exams.  No curve, point system.  i got a B+ and i didn't read any of the readings.. The readings are LONG articles.. Very interesting class tho. Lectures engage you.  Highly recommend. Easy GenEd. 8 weeks class."
314178,3.9,Christian,Haesemeyer,4,0.6536383598019994,"One of the best professors I've ever had. Focused on getting the entire class to really understand the material and not just try for the grade. Funny, likeable guy, excited about his subject. Very clear, helpful, and approachable.","He's pretty good as a teacher. He definitely cares for his class. He's very fair in his grading and he is very pleasant! His one weakness is he give very easy homeworks, so you won't be well prepared for 418 or graduate algebra if you just do his assignments.","Really nice easy going guy. Very reasonable, and really knows his stuff, but does not do a great job explaining it. He does go along with the book as much as possible though. HW can be tough (some are EASY), but tests are very fair.","very friendly and funny guy, but can't really explain things very well."
853931,4.4,Thomasanna,Hail,5,0.5238682481222473,"I only completed 1 of 8 Journals, 1 of 8 Discussion Boards, All homework and tests - and I got an A, she was very lenient, plus I answered a lot of bonus credit essay questions on tests.","It is so easy. You get 2 chances to do the online hw assignments, she averages the 2 scores... but after you take it once you get all the answers! You don't have to go to class at all, only when there is a movie or for a test. Take it with a friend! The tests are straight from the homework! SO EASY",Easy.  Do the homework. No ****.,"Loved the class.  Study the homeworks for the test, and make sure you do the online assignments.  Also try and take it with a friend.","Fairly easy class, Hail was very knowledgeable about the topics. The test questions came straight from the online homeworks. She made everything simple, not a tricky teacher."
1437621,4.8,Azeb,Haileselassie,7,0.6989906914872989,Exceptionally nice!!!,super nice!!!!,"She's a really nice teacher, always comes prepared and makes the class interesting.","Azeb is great, I would and already have recommended the course with her specifically to friends. Not only is she lively and engaging in the classroom but she also readily makes herself available outside of class. I thoroughly enjoyed this class and learned so much more than I had anticipated!","After 3 &amp; 1/2 years at the U of I, I can say that Mlle Haileselassie was the most helpful, most interesting, and overall best teacher that I have had. She is always excited about French and is always there to answer questions. Coming in as a student who had no background in French whatsoever, I left the class with excellent conversational skills.","I took 8 French courses at U of I and Azeb was the best teacher. She speaks very clear French and makes sure we understand everything. She doesn't use English in class, which is the right thing to do in a French class. In every class, she was very well prepared and she engaged us very much. I enjoyed every minute of her classes. Dfntly recommended","She speaks French in class, that helps you a lot. Homework is checked everyday of class. Attendant is required. In general, I think she is great TA."
1117270,4.1,Bruce,Hajek,5,0.5728721557536278,His notes is the worst on the topic.,Great professor.  His lectures are very interesting as well as entertaining.  Highly recommended.,"Professor Hajek is a wonderful professor. You get the feeling in class that he actually enjoys teaching and isn't a chore to him. He is easy to understand and he cares about his students. He is very helpful if you ever have any questions. The homework and tests are very fair, yet you learn a lot.... couldn't ask for a better professor.",Hajek is brilliant.  Knows his material like the back of his hand.  Text he wrote is very helpful and tests are straight forward and fair.  One flaw is his organization when giving lectures.  Writes all over the place but it is still useful.,UIUC is known because of professors like Prof. Bruce Hajek. I feel privileged to have been his student in the Random Process class :).  His notes are one of the best in this subject. He is an inspiration.
1157100,3.2,Eric,Hake,2,0.45576719668749544,"This guy has the credentials (Ph.D. UT) and he makes the class fun. The class average is a ""C"". But, a ""C"" is good in his class. If you want a free ride and are lazy, do not take his class. If you want to be a winner in life, choose his class.",This professor was ridicullously hard. He never gave anyone in class a grade higher than a B. Stay away from his class...
843959,4.2,Lippold,Haken,10,0.5796554546692216,"Haken was a very energetic teacher, but was easily flustered. He sometimes trivialized parts of the material, but genuinely wanted to help students learn. He was a decent lecturer, but often could not effectively clarify and explain important concepts, mostly using examples to teach.","Great professor who despite teaching upper level classes, still seems to care about those in the intro level ECE classes like ECE 110. Take him if you have the chance, he is a great teacher.","Professor Haken genuinely wanted everyone to do well and help. Very nice guy, very easy to understand. Only downside is he gets a little flustered in front of a class and sometimes makes mistakes. However, he willing accepts that he is wrong and is an animated speaker. Very interesting personal stories as well.",Great professor who is very excited about what he is teaching. Make sure you either but his transparencies from the bookstore or print them off before class. They are extremely helpful!,"I feel like you either love him or hate him. He is very interesting man and always has a great story. His continuum finger board is sick!!! Awesome dude. Just gotta see his sense of humor. Oh, and study hard for the tests. ECE is one of, if the hardest major at UIUC so you need to be serious about studying.","His lectures are very helpful, but I would recommend Brunet. Haken is a very intelligent person so his explanations aren't as clear as Brunet's.","He is very helpful, especially if you attend his office hours.  I went to most of his office hours to get help with the homework and never had any questions afterward.  The class is interesting and he has entertaining stories to go along with his teaching.  Recommended!","Haken made ECE110 a breeze for me - I've heard it's a terribly hard class but in the end, I really understood it from him.  Definitely one of my favorites.","Prof Haken is amazing. I never got the hang of the divider rules in 2 yrs of high school, it took just 50 mins for Prof. Haken to make me understand the whole thing. He teaches with patience, clarity, makes useful additions to the transparencies, he projects well without shouting, and he looks eager to teach and address doubts",No Comments
918135,5.0,Rudolf,Haken,1,0.8434149241616307,"After studying with him for several years, I have noticed that he can be unaware of his schedule (he will openly admit to this -  the best thing is just to be flexible).  BUT I see that as one of his only major flaws.  Aside from that, he is a genuinely NICE nice nice person and ultimately concerned about his students' well-being."
1094188,N/A,Jon,Hale,0,0
748605,4.0,Kevin,Hales,4,0.668766199091411,"Horrible teacher. I took American History and we were supposed to cover everything up until the Reconstruction, in the 1870's, and we didn't even get to the 1820's. He went many tangents, mostly about football, and we never covered the material we needed to learn. I missed so much and may need to audit it to learn the information.","Friendly, helpful, and extremely laid back, Kevin Hales will definitely shanghai you into learning something about afro-american studies.  Having come in in 05(?) as a replacement for a heavy-duty scholar, we in my class were pleasantly suprised to have such a vibrant presence in class who was just as willing to fall off on a tangent as we were.","Awesome, Awesome, Awesome Professor. The atmosphere in the class is so laid back and he is encouraging and accepting of everyone's comments. There are a lot of class discussions and it really makes the time pass quickly. He is a very easy grader,he really knows his subject, and just an all around great guy. If you can even get in the class,do it","This is a great class. There are many in-class discussions, the reading is minimal, the quizzes are easy, and the teacher is very friendly and funny. Definitely reccomend this class."
1810530,2.0,Brad,Halfpap,2,0.27344588423522165,"IClickers in class everyday, but lectures are painfully boring. I didn't even bother to buy the textbook and I pulled out an A in the class. Tests are very average and he doesn't give much instruction on how to prepare for them. I wouldn't take this unless you have to. You want Will Morong as a TA!!","Not very enthusiastic with lecture &amp; very wordy. (Get points for final exam if u go) Not enough practice except a couple hw problems online, not very good use of the book; don't buy the book unless you're going to use it. Very difficult to understand material if you don't have a good TA. Tons of practice tests online and around 10% curve each exam"
155844,3.6,Steve,Hall,82,0.6311240371526285,"For ADV 150, Professor Hall is a great professor and always has his own stories for everything. His lectures are not boring and the first day said all slides will have less than a sentence. He wants you to pass and will give TONS of extra credit. Attend class because half the test questions are from lecture and other half are textbook.","tests are divided between lectures and textbook. They do not cross pollinate. You can do well enough without the book, but be prepared to buy something brand new for an A","You do need to go to class to do well, listening and taking detailed notes on what he says and the examples he shows is needed to do well on the exams. But as long as you do that, the homework, and the 3 projects throughout, you're guaranteed an A. Steve is hilarious, though, class is always fun to attend.",On the second day of class I fainted and he rode in the ambulance with me and waited in the hospital with me for hours until I was released. I was so impressed by how caring he was. I will never forget his kindness.,"Professor Hall opened my eyes to advertising and how cool some projects can be. There was never a boring class. He told us what would be on the tests and helped us excel for the writing assignment we had. If you have an extra elective to burn, this class is awesome for it.",Professor Hall is a super cool guy and made me want to get into advertising. His lectures are almost all pictures and videos so make sure you take notes on what he shows (they're on the tests) The study guides are super accurate to whats on the test and towards the end of the semester he gives a ton of extra credit!,"His lectures are very engaging and interesting but make sure you take detailed notes because even small things will end up on tests.  Your grades are defined by how well you do on the 4 tests and the end group project.  Leave yourself a couple days to study.  USE THE STUDY GUIDE, HE MAKES HIS TESTS DIRECTLY FROM THEM.","PAY ATTENTION TO THE LECTURES! Write down specific details about the examples he shows in class. They might seem random, but they appear on the exams. His tests are split pretty much 50/50 between the lectures and text.","Hall is a really cool guy who definitely knows a LOT about the field of advertising. There's EC and 4 exams along with a online assignments and a few other assignments. You can only get like 3-4 wrong on the exams to get an A, so that's what sucks. Otherwise, definitely a very interesting and engaging class.","Steve is a very inspiring professor and really inspired me to pursue a career in the Advertising Industry. Gives good ""real world"" knowledge during lectures but for exams you will need to know you're textbook information as well and lecture ""real world"" knowledge. He doesn't remind you of homework that is due ""connect assignments"" do them yourself.",Pretty easy class. He is a way chill teacher. I would definitely recommend this if you are looking for something with an easy A.,"Steve is a great guy, though I did not learn much in ADV199. The field trip is fun, though we had no grade in the class until the last day of class. Definitely recommend taking a class with him at some point.",Honestly one of the coolest professors you will ever have the chance of meeting. He loves what he does and he loves making lectures fun and interesting. A lot of the test questions are about lecture so it's a good idea to go to class. I never missed a class of his because I loved it so much.,Awesome teacher. Makes lectures fun and it is clear that he wants the students to do well. This class is an easy A if you study for tests and I really enjoyed learning about advertising because of him.,One of my favorite classes. Go to lecture! 80% of the test comes from his lecture examples and definitions. You only have 4 tests (no final) and a project. The tests are very straightforward (he gives very detailed review guides and notes can be found online). He gives a fair amount of extra credit as well. Great class and professor!,This class was great. Easy and fun to go to lecture. Steve is a great professor and offers a lot of extra credit. Tells you everything that's on the test.,"He knows his stuff. He's an awesome teacher and makes lectures interesting. I would recommend scheduling office hours with him though, he's a pretty busy guy. Take notes in class and graze over the textbook and you'll be fine.",Steve is an awesome guy and an awesome teacher! He knows so much about the industry and makes lecture interesting. Make sure you take notes in lecture and read the textbook for the tests but don't stress too much because there are extra credit opportunities.,"Very interesting course about advertising in general, all the different agencies, and careers in the field. Exams were pretty easy and he's a cool guy.","This class is very easy.  Everything is very straightforward. But this professor is a very bad. Tests are poorly written. What a disgrace for an instructor who does not know how to write a proper exam. Also take very good notes in lecture since he will not post lecture notes online. He only post lecture outlines, which do not cover everything."
